listing_url,detail_url,image_url,price_listing,title,short_description,combined_description
https://www.prontocantiere.it/marchi/raimondi.html?limit=all,https://www.prontocantiere.it/marchi/raimondi/disco-monofaccia-al-carburo-di-silicio-raimondi.html,https://www.prontocantiere.it/media/catalog/product/cache/1/small_image/300x300/9df78eab33525d08d6e5fb8d27136e95/s/c/schermata_2014-10-28_a_16.15.33_1_.png,"21,50 €",5 DISCHI MONOFACCIA AL CARBURO DI SILICIO,"5 DISCHI MONOFACCIA AL CARBURO DI SILICIO PER IPER - SUPER E MAXITITINA



Per abradere e levigare superfici in cemento, resina, cotto, ecc.

Per graffiare superfici liscie allo scopo di migliorare l'aggrappaggio dell'adesivo.

Per asportare i residui di adesivo nel caso di rimozione di vecchi pavimenti.



PER MAGGIORI INFORMAZIONI RIGUARDO GRAMMATURE. APPLICAZIONI O ALTRO CONTATTACI VIA MAIL A: info@prontocantiere.it

OPPURE AL NUMERO: 3482403141 Cod. 27418G","Breve: 5 DISCHI MONOFACCIA AL CARBURO DI SILICIO PER IPER - SUPER E MAXITITINA



Per abradere e levigare superfici in cemento, resina, cotto, ecc.

Per graffiare superfici liscie allo scopo di migliorare l'aggrappaggio dell'adesivo.

Per asportare i residui di adesivo nel caso di rimozione di vecchi pavimenti.



PER MAGGIORI INFORMAZIONI RIGUARDO GRAMMATURE. APPLICAZIONI O ALTRO CONTATTACI VIA MAIL A: info@prontocantiere.it

OPPURE AL NUMERO: 3482403141 Cod. 27418G"
https://www.prontocantiere.it/marchi/raimondi.html?limit=all,https://www.prontocantiere.it/marchi/raimondi/air-raizor-sistema-per-il-taglio-di-lastre-di-grande-formato-per-trasporto-aereo.html,https://www.prontocantiere.it/media/catalog/product/cache/1/small_image/300x300/9df78eab33525d08d6e5fb8d27136e95/a/i/air_raizor.png,"976,00 €",AIR RAIZOR - SISTEMA PER IL TAGLIO DI LASTRE DI GRANDE FORMATO (PER TRASPORTO AEREO),Sistema di taglio per lastre di grande formato di lungezza massima 332 cm (447 cm con prolunga opzionale) - KIT PER TRASPORTO AEREO Cod. 433CRAF35,Breve: Sistema di taglio per lastre di grande formato di lungezza massima 332 cm (447 cm con prolunga opzionale) - KIT PER TRASPORTO AEREO Cod. 433CRAF35
https://www.prontocantiere.it/marchi/raimondi.html?limit=all,https://www.prontocantiere.it/marchi/raimondi/banco-indipendente-5-rulli-70x50-cm-raimondi.html,https://www.prontocantiere.it/media/catalog/product/cache/1/small_image/300x300/9df78eab33525d08d6e5fb8d27136e95/b/a/banco_ibndipendente_5_rulli.png,"319,00 €",Banco indipendente 5 rulli (70x50 cm) Raimondi,Banco indipendente 5 rulli (70x50 cm) da utilizzare con tutte le segatrici Raimondi Cod. 374RU5D40I,Breve: Banco indipendente 5 rulli (70x50 cm) da utilizzare con tutte le segatrici Raimondi Cod. 374RU5D40I
https://www.prontocantiere.it/marchi/raimondi.html?limit=all,https://www.prontocantiere.it/marchi/raimondi/rls-basi-hd-1-mm-raimondi-spess-piastr-3-12-mm-1600-pezzi.html,https://www.prontocantiere.it/media/catalog/product/cache/1/small_image/300x300/9df78eab33525d08d6e5fb8d27136e95/1/m/1mm.png,"110,00 €","Basi RLS HD ""1 mm"" THE ONE Raimondi Spess. Piastr. 3-12 mm - 1600 pezzi",Base R.L.S. HD per piastrelle di spessore da 3 a 12 mm fuga 1 mm - confezione convenienza da 1600 pezzi! Cod. 180B10H12P1600,Breve: Base R.L.S. HD per piastrelle di spessore da 3 a 12 mm fuga 1 mm - confezione convenienza da 1600 pezzi! Cod. 180B10H12P1600
https://www.prontocantiere.it/marchi/raimondi.html?limit=all,https://www.prontocantiere.it/marchi/raimondi/basi-rls-hd-0-5-mm-spess-piastr-3-12-mm-300-pz.html,https://www.prontocantiere.it/media/catalog/product/cache/1/small_image/300x300/9df78eab33525d08d6e5fb8d27136e95/0/_/0.5_mm.png,"56,10 €",Basi RLS HD 0.5 mm - Spess. Piastr. 3-12 mm - 300 PZ,Base R.L.S. per piastrelle di spessore da 3 a 12 mm fuga 0.5 mm - 300 pezzi Cod. 180BAS05B300,Breve: Base R.L.S. per piastrelle di spessore da 3 a 12 mm fuga 0.5 mm - 300 pezzi Cod. 180BAS05B300
https://www.prontocantiere.it/marchi/raimondi.html?limit=all,https://www.prontocantiere.it/marchi/raimondi/basi-rls-1-5-mm-spess-piastr-3-12-mm-250-pz.html,https://www.prontocantiere.it/media/catalog/product/cache/1/small_image/300x300/9df78eab33525d08d6e5fb8d27136e95/h/d/hd_1.5.jpg,"26,50 €","Basi RLS HD 1,5 mm - Spess. Piastr. 3-12 mm - 250 PZ","Distanziatori basi RLS HD per piastrelle 3-12 mm - Fuga 1,5 mm - Confezione da DA 250 PEZZI Cod. 180BAS15B0250","Breve: Distanziatori basi RLS HD per piastrelle 3-12 mm - Fuga 1,5 mm - Confezione da DA 250 PEZZI Cod. 180BAS15B0250"
https://www.prontocantiere.it/marchi/raimondi.html?limit=all,https://www.prontocantiere.it/marchi/raimondi/basi-rls-hd-1-5-mm-spess-piast-3-12-mm-2200-pezzi.html,https://www.prontocantiere.it/media/catalog/product/cache/1/small_image/300x300/9df78eab33525d08d6e5fb8d27136e95/s/c/schermata_2014-10-30_a_14.07.07_2.png,"145,00 €","Basi RLS HD 1,5 mm Spess. Piast. 3-12 mm - 2200 pezzi","Base R.L.S. per piastrelle di spessore da 3 a 12 mm fuga 1,5 mm - confezione convenienza da 2200 pezzi! Cod. 180BAS15B2200","Breve: Base R.L.S. per piastrelle di spessore da 3 a 12 mm fuga 1,5 mm - confezione convenienza da 2200 pezzi! Cod. 180BAS15B2200"
https://www.prontocantiere.it/marchi/raimondi.html?limit=all,https://www.prontocantiere.it/marchi/raimondi/battipiastrelle-mastino-raimondi.html,https://www.prontocantiere.it/media/catalog/product/cache/1/small_image/300x300/9df78eab33525d08d6e5fb8d27136e95/m/a/mastino.jpg,"1.999,00 €",Battipiastrelle MASTINO Raimondi,"Batti - piastrelle - 36 rulli Ø55 mm - Economica, leggera e facile da usare Cod. 349","Breve: Batti - piastrelle - 36 rulli Ø55 mm - Economica, leggera e facile da usare Cod. 349"
https://www.prontocantiere.it/marchi/raimondi.html?limit=all,https://www.prontocantiere.it/marchi/raimondi/battipiastrelle-terranova-raimondi.html,https://www.prontocantiere.it/media/catalog/product/cache/1/small_image/300x300/9df78eab33525d08d6e5fb8d27136e95/t/e/terranova.jpg,"1.340,00 €",Battipiastrelle TERRANOVA Raimondi,"Batti - piastrelle - 44 rulli Ø40 mm - Economica, leggera e facile da usare Cod. 105","Breve: Batti - piastrelle - 44 rulli Ø40 mm - Economica, leggera e facile da usare Cod. 105"
https://www.prontocantiere.it/marchi/raimondi.html?limit=all,https://www.prontocantiere.it/marchi/raimondi/bc45-dispositivo-per-l-esecuzione-di-smussi-a-45-jolly.html,https://www.prontocantiere.it/media/catalog/product/cache/1/small_image/300x300/9df78eab33525d08d6e5fb8d27136e95/b/c/bc45_dischi.jpg,"390,00 €",BC45 - Dispositivo per l'esecuzione di smussi a 45° (Jolly),BC45 per l'esecuzione di smussi a 45° (Jolly) Cod. 433BCOH EU,Breve: BC45 per l'esecuzione di smussi a 45° (Jolly) Cod. 433BCOH EU
https://www.prontocantiere.it/marchi/raimondi.html?limit=all,https://www.prontocantiere.it/marchi/raimondi/binario-raimondi-raizor-322raizor.html,https://www.prontocantiere.it/media/catalog/product/cache/1/small_image/300x300/9df78eab33525d08d6e5fb8d27136e95/g/u/guida_1.jpg,"183,00 €",Binario Raimondi Raizor 322RAIZOR,Binario Raimondi Raizor 322RAIZOR Cod. 322RAIZOR,Breve: Binario Raimondi Raizor 322RAIZOR Cod. 322RAIZOR
https://www.prontocantiere.it/marchi/raimondi.html?limit=all,https://www.prontocantiere.it/marchi/raimondi/biventosa-plus-raimondi-con-gomma-trilabbro-antimacchia-per-superfici-lisce-e-strutturate.html,https://www.prontocantiere.it/media/catalog/product/cache/1/small_image/300x300/9df78eab33525d08d6e5fb8d27136e95/s/-/s-l500_1.jpg,"38,00 €",Biventosa PLUS Raimondi con gomma trilabbro antimacchia per superfici lisce e strutturate,Biventosa PLUS Raimondi con gomma trilabbro antimacchia per superfici lisce e strutturate Cod. 185BIMK3RP,Breve: Biventosa PLUS Raimondi con gomma trilabbro antimacchia per superfici lisce e strutturate Cod. 185BIMK3RP
https://www.prontocantiere.it/marchi/raimondi.html?limit=all,https://www.prontocantiere.it/marchi/raimondi/bm180-banco-di-lavoro-modulare-raimondi-394mamk3rai.html,https://www.prontocantiere.it/media/catalog/product/cache/1/small_image/300x300/9df78eab33525d08d6e5fb8d27136e95/3/9/394ma-rai_alone_alto_raimondi_190620691.jpg,"759,00 €",BM180 - Banco di lavoro modulare Raimondi 394MAMK3RAI,"Piano robusto e stabile, ideale per il taglio e la lavorazione di grandi lastre ceramiche con la sua struttura in acciaio ed il piano da lavoro in alluminio profilato anodizzato.

Semplice da assemblare e smontare. Le gambe pieghevoli e i piedini regolabili lo rendono molto pratico e poco ingombrante. Cod. 394MAMK3RAI","Breve: Piano robusto e stabile, ideale per il taglio e la lavorazione di grandi lastre ceramiche con la sua struttura in acciaio ed il piano da lavoro in alluminio profilato anodizzato.

Semplice da assemblare e smontare. Le gambe pieghevoli e i piedini regolabili lo rendono molto pratico e poco ingombrante. Cod. 394MAMK3RAI"
https://www.prontocantiere.it/marchi/raimondi.html?limit=all,https://www.prontocantiere.it/marchi/raimondi/cam-mkiii-carrello-per-trasporto-lastre-e-dispositivi-di-movimentazione.html,https://www.prontocantiere.it/media/catalog/product/cache/1/small_image/300x300/9df78eab33525d08d6e5fb8d27136e95/i/m/immagine_3.png,"809,00 €",CAM MKIII - CARRELLO PER TRASPORTO LASTRE E DISPOSITIVI DI MOVIMENTAZIONE,"Dimensioni : larghezza cm 75,  lunghezza cm 130, altezza cm 150, peso 20,4 kg, portata 250 kg. Cod. 169CEL UN","Breve: Dimensioni : larghezza cm 75,  lunghezza cm 130, altezza cm 150, peso 20,4 kg, portata 250 kg. Cod. 169CEL UN"
https://www.prontocantiere.it/marchi/raimondi.html?limit=all,https://www.prontocantiere.it/marchi/raimondi/canini-28-mm-raimondi.html,https://www.prontocantiere.it/media/catalog/product/cache/1/small_image/300x300/9df78eab33525d08d6e5fb8d27136e95/s/c/schermata_2014-10-30_a_15.44.31.png,"6,50 €",Canini 28 mm. Raimondi - 1000 PEZZI,Confezione da 1000 pz. - Canino spessoramento. Cod. 163P1000,Breve: Confezione da 1000 pz. - Canino spessoramento. Cod. 163P1000
https://www.prontocantiere.it/marchi/raimondi.html?limit=all,https://www.prontocantiere.it/marchi/raimondi/canini-40-mm-raimondi.html,https://www.prontocantiere.it/media/catalog/product/cache/1/small_image/300x300/9df78eab33525d08d6e5fb8d27136e95/s/c/schermata_2014-10-30_a_15.44.24.png,"7,50 €",Canini 40 mm. Raimondi - 1000 PEZZI,Confezione da 1000 pz - Canino spessoramento. Cod. 163G1000,Breve: Confezione da 1000 pz - Canino spessoramento. Cod. 163G1000
https://www.prontocantiere.it/marchi/raimondi.html?limit=all,https://www.prontocantiere.it/marchi/raimondi/carrucola-di-scorrimento-con-cuscinetto-per-segatrice-zoe-e-pikus.html,https://www.prontocantiere.it/media/catalog/product/cache/1/small_image/300x300/9df78eab33525d08d6e5fb8d27136e95/3/b/3b6ad429-048c-4bcc-84d3-64193f918864.jpg,"9,90 €",Carrucola di scorrimento con cuscinetto per segatrice ZOE e PIKUS,"Rotella di scorrimento di ricambio concava diam. 42,4 mm per segatrici ZOE e PIKUS Raimondi Cod. 309CS01A","Breve: Rotella di scorrimento di ricambio concava diam. 42,4 mm per segatrici ZOE e PIKUS Raimondi Cod. 309CS01A"
https://www.prontocantiere.it/marchi/raimondi.html?limit=all,https://www.prontocantiere.it/marchi/raimondi/carrucola-di-scorrimento-concava-con-cuscinetto-per-segatrice-exploit-s99-adv-sherpa.html,https://www.prontocantiere.it/media/catalog/product/cache/1/small_image/300x300/9df78eab33525d08d6e5fb8d27136e95/b/3/b3f95c73-3504-4c7e-a4ad-837bd162290c.jpg,"9,90 €","Carrucola di scorrimento concava con cuscinetto per segatrice EXPLOIT / S99, ADV / SHERPA","Carrucola di scorrimento concava con cuscinetto per segatrice EXPLOIT / S99, ADV / SHERPA Cod. 309CV02A","Breve: Carrucola di scorrimento concava con cuscinetto per segatrice EXPLOIT / S99, ADV / SHERPA Cod. 309CV02A"
https://www.prontocantiere.it/marchi/raimondi.html?limit=all,https://www.prontocantiere.it/marchi/raimondi/carter-raimondi-per-segatrice-exploit-art-262cp00d.html,https://www.prontocantiere.it/media/catalog/product/cache/1/small_image/300x300/9df78eab33525d08d6e5fb8d27136e95/i/m/immagine_whatsapp_2025-03-19_ore_14.55.18_9b4094fa.jpg,"14,65 €",Carter Raimondi per segatrice Exploit art. 262CP00D,Carter Raimondi per segatrice Exploit art. 262CP00D Cod. 262CP00D,Breve: Carter Raimondi per segatrice Exploit art. 262CP00D Cod. 262CP00D
https://www.prontocantiere.it/marchi/raimondi.html?limit=all,https://www.prontocantiere.it/marchi/raimondi/ciabatte-con-punte-raimondi.html,https://www.prontocantiere.it/media/catalog/product/cache/1/small_image/300x300/9df78eab33525d08d6e5fb8d27136e95/s/c/schermata_2014-10-30_a_09.24.58.png,"37,50 €",Ciabatte con punte Raimondi,"Ciabatte ""Husky"" per posa con adesivo. Cod. 137HUSKY","Breve: Ciabatte ""Husky"" per posa con adesivo. Cod. 137HUSKY"
https://www.prontocantiere.it/marchi/raimondi.html?limit=all,https://www.prontocantiere.it/marchi/raimondi/ciabatte-lisce-raimondi.html,https://www.prontocantiere.it/media/catalog/product/cache/1/small_image/300x300/9df78eab33525d08d6e5fb8d27136e95/s/c/schermata_2014-10-30_a_09.24.47.png,"17,95 €",Ciabatte lisce per sottofondi con molla Raimondi,Ciabatte lisce per sottofondi con molla. Cod. 137BMOLLA,Breve: Ciabatte lisce per sottofondi con molla. Cod. 137BMOLLA
https://www.prontocantiere.it/marchi/raimondi.html?limit=all,https://www.prontocantiere.it/marchi/raimondi/ciabatte-rigate-raimondi.html,https://www.prontocantiere.it/media/catalog/product/cache/1/small_image/300x300/9df78eab33525d08d6e5fb8d27136e95/s/c/schermata_2014-10-30_a_09.24.30.png,"17,50 €",Ciabatte Raimondi rigate per piastrelle con elastico,Ciabatte rigate per piastrelle con molla. Cod. 137MOLLA,Breve: Ciabatte rigate per piastrelle con molla. Cod. 137MOLLA
https://www.prontocantiere.it/marchi/raimondi.html?limit=all,https://www.prontocantiere.it/marchi/raimondi/closer-dispositivo-accosta-lastre-raimondi.html,https://www.prontocantiere.it/media/catalog/product/cache/1/small_image/300x300/9df78eab33525d08d6e5fb8d27136e95/c/l/closer_new.png,"195,90 €",Closer - dispositivo accosta lastre - Raimondi,CLOSER - DISPOSITIVO ACCOSTA LASTRE CON TRIVENTOSE GRIGIE ANTIMACCHIA PER LASTRE LISCE E STRUTTURATE Cod. 185DALMK2,Breve: CLOSER - DISPOSITIVO ACCOSTA LASTRE CON TRIVENTOSE GRIGIE ANTIMACCHIA PER LASTRE LISCE E STRUTTURATE Cod. 185DALMK2
https://www.prontocantiere.it/marchi/raimondi.html?limit=all,https://www.prontocantiere.it/marchi/raimondi/controsquadro-telescopico-90-45-per-segatrici-raimondi-pikus-sms-zoe.html,https://www.prontocantiere.it/media/catalog/product/cache/1/small_image/300x300/9df78eab33525d08d6e5fb8d27136e95/1/9/191cl04a.png,"239,00 €",Controsquadro Telescopico 90°/45° per Segatrici Raimondi PIKUS/SMS/ZOE,Controsquadro Telescopico 90°/45° per Segatrici Raimondi PIKUS / SMS / ZOE Cod. 191CL04A1,Breve: Controsquadro Telescopico 90°/45° per Segatrici Raimondi PIKUS / SMS / ZOE Cod. 191CL04A1
https://www.prontocantiere.it/marchi/raimondi.html?limit=all,https://www.prontocantiere.it/marchi/raimondi/coppia-aste-contenimento-acqua-raimondi-per-pikus-105-sms-100-e-zoe-105.html,https://www.prontocantiere.it/media/catalog/product/cache/1/small_image/300x300/9df78eab33525d08d6e5fb8d27136e95/a/s/aste_contenimento_acqua_raimondi_1.png,"125,00 €",Coppia aste contenimento acqua Raimondi per PIKUS 105 / SMS 100 e ZOE 105,Coppia aste contenimento acqua Raimondi per PIKUS 105 / SMS 100 e ZOE 105 Cod. 263PE04A105,Breve: Coppia aste contenimento acqua Raimondi per PIKUS 105 / SMS 100 e ZOE 105 Cod. 263PE04A105
https://www.prontocantiere.it/marchi/raimondi.html?limit=all,https://www.prontocantiere.it/marchi/raimondi/coppia-aste-contenimento-acqua-raimondi-per-pikus-130-sms-125-e-zoe-130.html,https://www.prontocantiere.it/media/catalog/product/cache/1/small_image/300x300/9df78eab33525d08d6e5fb8d27136e95/a/s/aste_contenimento_acqua_raimondi_1_1.png,"129,00 €",Coppia aste contenimento acqua Raimondi per PIKUS 130 / SMS 125 e ZOE 130,Coppia aste contenimento acqua Raimondi per PIKUS 130 / SMS 125 e ZOE 130 Cod. 263PE04A130,Breve: Coppia aste contenimento acqua Raimondi per PIKUS 130 / SMS 125 e ZOE 130 Cod. 263PE04A130
https://www.prontocantiere.it/marchi/raimondi.html?limit=all,https://www.prontocantiere.it/marchi/raimondi/coppia-aste-contenimento-acqua-raimondi-per-sms-150-e-zoe-150.html,https://www.prontocantiere.it/media/catalog/product/cache/1/small_image/300x300/9df78eab33525d08d6e5fb8d27136e95/a/s/aste_contenimento_acqua_raimondi.png,"139,00 €",Coppia aste contenimento acqua Raimondi per SMS 150 e ZOE 150,Coppia aste contenimento acqua Raimondi per SMS 150 e ZOE 150 Cod. 263PE04A150,Breve: Coppia aste contenimento acqua Raimondi per SMS 150 e ZOE 150 Cod. 263PE04A150
https://www.prontocantiere.it/marchi/raimondi.html?limit=all,https://www.prontocantiere.it/marchi/raimondi/coppia-elastici-per-ciabatte-raimondi.html,https://www.prontocantiere.it/media/catalog/product/cache/1/small_image/300x300/9df78eab33525d08d6e5fb8d27136e95/l/a/lacci_ciabattein_gomma.jpg,"2,50 €",Coppia elastici per ciabatte Raimondi,Coppia elastici per ciabatte Raimondi Cod. 196,Breve: Coppia elastici per ciabatte Raimondi Cod. 196
https://www.prontocantiere.it/marchi/raimondi.html?limit=all,https://www.prontocantiere.it/marchi/raimondi/coppia-elastici-per-ginocchiere-raimondi.html,https://www.prontocantiere.it/media/catalog/product/cache/1/small_image/300x300/9df78eab33525d08d6e5fb8d27136e95/e/l/elastici_r_1.jpg,"2,00 €",Coppia elastici per ginocchiere Raimondi,Coppia elastici per ginocchiere Raimondi Cod. 196GCAA,Breve: Coppia elastici per ginocchiere Raimondi Cod. 196GCAA
https://www.prontocantiere.it/marchi/raimondi.html?limit=all,https://www.prontocantiere.it/marchi/raimondi/coppia-maniglie-carrello-per-segatrici-raimondi-sa80-sa09-sherpa.html,https://www.prontocantiere.it/media/catalog/product/cache/1/small_image/300x300/9df78eab33525d08d6e5fb8d27136e95/m/a/maniglie.png,"65,00 €",Coppia maniglie carrello per Segatrici Raimondi SA80/SA09/SHERPA,Coppia maniglie carrello per Segatrici Raimondi SA80/SA09/SHERPA Cod. 154SE17CP,Breve: Coppia maniglie carrello per Segatrici Raimondi SA80/SA09/SHERPA Cod. 154SE17CP
https://www.prontocantiere.it/marchi/raimondi.html?limit=all,https://www.prontocantiere.it/marchi/raimondi/coppia-molle-con-moschettoni-per-ciabatte-raimondi.html,https://www.prontocantiere.it/media/catalog/product/cache/1/small_image/300x300/9df78eab33525d08d6e5fb8d27136e95/m/o/molle_ciabatte.jpg,"4,50 €",Coppia molle con moschettoni per ciabatte Raimondi,Coppia molle con moschettoni per ciabatte Raimondi Cod. 314TR02D,Breve: Coppia molle con moschettoni per ciabatte Raimondi Cod. 314TR02D
https://www.prontocantiere.it/marchi/raimondi.html?limit=all,https://www.prontocantiere.it/marchi/raimondi/coppia-ruote-per-gambe-banco-bm180-raimondi.html,https://www.prontocantiere.it/media/catalog/product/cache/1/small_image/300x300/9df78eab33525d08d6e5fb8d27136e95/c/o/coppia_ruote_bm180.png,"61,00 €",Coppia ruote per gambe banco BM180 Raimondi,Coppia ruote per gambe banco BM180 Raimondi Cod. 394CRR,Breve: Coppia ruote per gambe banco BM180 Raimondi Cod. 394CRR
https://www.prontocantiere.it/marchi/raimondi.html?limit=all,https://www.prontocantiere.it/marchi/raimondi/dischi-abrasivi-bifaccia-al-carburo-di-tungsteno-ipertitina-gr-36.html,https://www.prontocantiere.it/media/catalog/product/cache/1/small_image/300x300/9df78eab33525d08d6e5fb8d27136e95/i/m/img_601509_194006raimondi-dischi-abrasivi-per-supertitina-gr-16-24-36-art.2744w_2.jpg,"166,00 €",DISCHI ABRASIVI BIFACCIA AL CARBURO DI TUNGSTENO IPERTITINA GR. 36,"Per carteggiare superfici in cemento, resina, cotto, metallo, legno e per gtaffiare superfici lisce allo scopo di migliorare l'aggrappaggio dell'adesivo. Cod. 027450W36","Breve: Per carteggiare superfici in cemento, resina, cotto, metallo, legno e per gtaffiare superfici lisce allo scopo di migliorare l'aggrappaggio dell'adesivo. Cod. 027450W36"
https://www.prontocantiere.it/marchi/raimondi.html?limit=all,https://www.prontocantiere.it/marchi/raimondi/dischi-abrasivi-bifaccia-ipertitina-raimondi.html,https://www.prontocantiere.it/media/catalog/product/cache/1/small_image/300x300/9df78eab33525d08d6e5fb8d27136e95/d/i/dischi-abrasivi-bifaccia-al-carburo-di-silicio-gr100-per-supertitina2.jpg,N/A,Dischi abrasivi bifaccia Ipertitina Raimondi 5 PEZZI,1 CONFEZIONE DA 5 PZ. - Dischi abrasivi bifaccia al carburo di silicio per Ipertitina e Ipertitina Plus. Cod. 27450G,Breve: 1 CONFEZIONE DA 5 PZ. - Dischi abrasivi bifaccia al carburo di silicio per Ipertitina e Ipertitina Plus. Cod. 27450G
https://www.prontocantiere.it/marchi/raimondi.html?limit=all,https://www.prontocantiere.it/marchi/raimondi/dischi-abrasivi-bifaccia-maxititina-raimondi.html,https://www.prontocantiere.it/media/catalog/product/cache/1/small_image/300x300/9df78eab33525d08d6e5fb8d27136e95/d/i/dischi-abrasivi-bifaccia-al-carburo-di-silicio-gr100-per-supertitina2_1.jpg,N/A,Dischi abrasivi bifaccia Maxititina Raimondi - 5 PEZZI,1 CONFEZIONE DA 5 PEZZI  - Dischi abrasivi bifaccia al carburo di silicio per Maxititina. Cod. 27445G,Breve: 1 CONFEZIONE DA 5 PEZZI  - Dischi abrasivi bifaccia al carburo di silicio per Maxititina. Cod. 27445G
https://www.prontocantiere.it/marchi/raimondi.html?limit=all,https://www.prontocantiere.it/marchi/raimondi/dischi-abrasivi-bifaccia-supertitina-raimondi-4207.html,https://www.prontocantiere.it/media/catalog/product/cache/1/small_image/300x300/9df78eab33525d08d6e5fb8d27136e95/d/i/dischi-abrasivi-bifaccia-al-carburo-di-silicio-gr100-per-supertitina2_1_1_1.jpg,N/A,Dischi abrasivi bifaccia Supertitina Raimondi - 5 PEZZI,1 CONFEZIONE DA 5 PZ.  - Dischi abrasivi bifaccia al carburo di silicio per Supertitina. Cod. 27440G-2,Breve: 1 CONFEZIONE DA 5 PZ.  - Dischi abrasivi bifaccia al carburo di silicio per Supertitina. Cod. 27440G-2
https://www.prontocantiere.it/marchi/raimondi.html?limit=all,https://www.prontocantiere.it/marchi/raimondi/disco-abrasivi-bifaccia-al-carburo-di-tungsteno-ipertitina-gr-24.html,https://www.prontocantiere.it/media/catalog/product/cache/1/small_image/300x300/9df78eab33525d08d6e5fb8d27136e95/i/m/img_601509_194006raimondi-dischi-abrasivi-per-supertitina-gr-16-24-36-art.2744w_1.jpg,"166,00 €",DISCO ABRASIVI BIFACCIA AL CARBURO DI TUNGSTENO IPERTITINA GR. 24,"Per carteggiare superfici in cemento, resina, cotto, metallo, legno e per gtaffiare superfici lisce allo scopo di migliorare l'aggrappaggio dell'adesivo. Cod. 027450W24","Breve: Per carteggiare superfici in cemento, resina, cotto, metallo, legno e per gtaffiare superfici lisce allo scopo di migliorare l'aggrappaggio dell'adesivo. Cod. 027450W24"
https://www.prontocantiere.it/marchi/raimondi.html?limit=all,https://www.prontocantiere.it/marchi/raimondi/dischi-abrasivi-bifaccia-al-carburo-di-tungsteno-ipertitina-gr-16.html,https://www.prontocantiere.it/media/catalog/product/cache/1/small_image/300x300/9df78eab33525d08d6e5fb8d27136e95/i/m/img_601509_194006raimondi-dischi-abrasivi-per-supertitina-gr-16-24-36-art.2744w.jpg,"166,00 €",DISCO ABRASIVO BIFACCIA AL CARBURO DI TUNGSTENO IPERTITINA GR. 16,"Per carteggiare superfici in cemento, resina, cotto, metallo, legno e per gtaffiare superfici lisce allo scopo di migliorare l'aggrappaggio dell'adesivo. Cod. 027450W16","Breve: Per carteggiare superfici in cemento, resina, cotto, metallo, legno e per gtaffiare superfici lisce allo scopo di migliorare l'aggrappaggio dell'adesivo. Cod. 027450W16"
https://www.prontocantiere.it/marchi/raimondi.html?limit=all,https://www.prontocantiere.it/marchi/raimondi/dischi-abrasivi-tungsteno-bifaccia-maxititina-raimondi.html,https://www.prontocantiere.it/media/catalog/product/cache/1/small_image/300x300/9df78eab33525d08d6e5fb8d27136e95/t/u/tungbifacc_1.png,N/A,Disco abrasivo tungsteno bifaccia Maxititina Raimondi,Singolo Disco abrasivo bifaccia al carburo di Tungsteno per Maxititina. Cod. 27445W,Breve: Singolo Disco abrasivo bifaccia al carburo di Tungsteno per Maxititina. Cod. 27445W
https://www.prontocantiere.it/marchi/raimondi.html?limit=all,https://www.prontocantiere.it/marchi/raimondi/disco-con-3-mole-al-caburo-di-silicio-per-supertitina-raimondi.html,https://www.prontocantiere.it/media/catalog/product/cache/1/small_image/300x300/9df78eab33525d08d6e5fb8d27136e95/t/h/thumb-2.jpg,"144,00 €",Disco con 3 mole al caburo di silicio per SUPERTITINA RAIMONDI,Disco con 3 mole al caburo di silicio per SUPERTITINA RAIMONDI COD.230 Cod. 2300,Breve: Disco con 3 mole al caburo di silicio per SUPERTITINA RAIMONDI COD.230 Cod. 2300
https://www.prontocantiere.it/marchi/raimondi.html?limit=all,https://www.prontocantiere.it/marchi/raimondi/disco-con-fibrodischi-ipertitina-raimondi.html,https://www.prontocantiere.it/media/catalog/product/cache/1/small_image/300x300/9df78eab33525d08d6e5fb8d27136e95/f/i/fibrodischi5_1.jpg,"139,00 €",Disco con 5 fibrodischi al carburo di silicio per Ipertitina Raimondi,Disco con 5 fibrodischi al carburo di silicio per Ipertitina e Ipertitina Plus. Cod. 249IPER,Breve: Disco con 5 fibrodischi al carburo di silicio per Ipertitina e Ipertitina Plus. Cod. 249IPER
https://www.prontocantiere.it/marchi/raimondi.html?limit=all,https://www.prontocantiere.it/marchi/raimondi/disco-con-fibrodischi-maxititina-raimondi.html,https://www.prontocantiere.it/media/catalog/product/cache/1/small_image/300x300/9df78eab33525d08d6e5fb8d27136e95/f/i/fibrodischi5.jpg,"145,00 €",Disco con 5 fibrodischi al carburo di silicio per Maxititina Raimondi,Disco con 5 fibrodischi al carburo di silicio per Maxititina. Cod. 249,Breve: Disco con 5 fibrodischi al carburo di silicio per Maxititina. Cod. 249
