listing_url,detail_url,image_url,price_listing,title,short_description,combined_description
https://www.prontocantiere.it/marchi/raimondi.html?limit=all,https://www.prontocantiere.it/marchi/raimondi/mola-al-carburo-silicio-raimondi.html,https://www.prontocantiere.it/media/catalog/product/cache/1/small_image/300x300/9df78eab33525d08d6e5fb8d27136e95/s/c/schermata_2014-10-28_a_16.15.21.png,"10,10 €",Mola al carburo di silicio Raimondi,Mola al carburo di silicio Gr. 16. Cod. 273C5,Breve: Mola al carburo di silicio Gr. 16. Cod. 273C5
https://www.prontocantiere.it/marchi/raimondi.html?limit=all,https://www.prontocantiere.it/marchi/raimondi/mola-al-carburo-16-raimondi.html,https://www.prontocantiere.it/media/catalog/product/cache/1/small_image/300x300/9df78eab33525d08d6e5fb8d27136e95/s/c/schermata_2014-10-28_a_16.14.19.png,"42,90 €",Mola al carburo tungsteno - grana 16 Raimondi,Mola al carburo di tungsteno Gr. 16. Cod. 273W16,Breve: Mola al carburo di tungsteno Gr. 16. Cod. 273W16
https://www.prontocantiere.it/marchi/raimondi.html?limit=all,https://www.prontocantiere.it/marchi/raimondi/mola-con-6-chiodi-raimondi.html,https://www.prontocantiere.it/media/catalog/product/cache/1/small_image/300x300/9df78eab33525d08d6e5fb8d27136e95/m/o/molachiodi.jpg,"21,50 €",Mola con 6 chiodi Raimondi,Mola con 6 chiodi al carburo di tungsteno. Cod. 273CHIODI,Breve: Mola con 6 chiodi al carburo di tungsteno. Cod. 273CHIODI
https://www.prontocantiere.it/marchi/raimondi.html?limit=all,https://www.prontocantiere.it/marchi/raimondi/monospazzola-ipertitina-plus-raimondi.html,https://www.prontocantiere.it/media/catalog/product/cache/1/small_image/300x300/9df78eab33525d08d6e5fb8d27136e95/i/p/ipertitina-plus.jpg,"2.439,00 €",Monospazzola IPERTITINA PLUS Raimondi,"Monospazzola multiuso professionale, facile da usare, eccezionale macchinario da cantiere con molteplici usi.  


PER RICAMBI ED ACCESSORI CONTATTACI 0438418365 Cod. 108 BIL110","Breve: Monospazzola multiuso professionale, facile da usare, eccezionale macchinario da cantiere con molteplici usi.  


PER RICAMBI ED ACCESSORI CONTATTACI 0438418365 Cod. 108 BIL110"
https://www.prontocantiere.it/marchi/raimondi.html?limit=all,https://www.prontocantiere.it/marchi/raimondi/monospazzola-ipertitina-raimondi.html,https://www.prontocantiere.it/media/catalog/product/cache/1/small_image/300x300/9df78eab33525d08d6e5fb8d27136e95/i/p/ipertitina.jpg,"2.050,00 €",Monospazzola IPERTITINA Raimondi,"Monospazzola multiuso professionale, facile da usare, eccezionale macchinario da cantiere con molteplici usi.


PER RICAMBI ED ACCESSORI CONTATTACI 0438418365 Cod. 108","Breve: Monospazzola multiuso professionale, facile da usare, eccezionale macchinario da cantiere con molteplici usi.


PER RICAMBI ED ACCESSORI CONTATTACI 0438418365 Cod. 108"
https://www.prontocantiere.it/marchi/raimondi.html?limit=all,https://www.prontocantiere.it/marchi/raimondi/monospazzola-maxititina.html,https://www.prontocantiere.it/media/catalog/product/cache/1/small_image/300x300/9df78eab33525d08d6e5fb8d27136e95/m/a/maxititina.jpg,"1.403,00 €",Monospazzola MAXITITINA Raimondi,"Monospazzola multiuso professionale, facile da usare, eccezionale macchinario da cantiere con molteplici usi.


PER RICAMBI ED ACCESSORI CONTATTACI 0438418365 Cod. 219","Breve: Monospazzola multiuso professionale, facile da usare, eccezionale macchinario da cantiere con molteplici usi.


PER RICAMBI ED ACCESSORI CONTATTACI 0438418365 Cod. 219 --- Completa: •Monospazzola per la stuccatura dei pavimenti fugati, per la lisciatura dei massetti, per levigare e carteggiare superfici, per il lavaggio e il trattamento del cotto toscano.
•Manico telescopico con inclinazione regolabile.
•Utensili ad innesto rapido.
•Due velocità di rotazione 55/110 giri/minuto.
•Diametro utensili da 45 cm (17 3/4"") a 60 cm (23 5/8"").
•Corredo: kit chiavi, manuale uso e manutenzione."
https://www.prontocantiere.it/marchi/raimondi.html?limit=all,https://www.prontocantiere.it/marchi/raimondi/monospazzola-microtitina-raimondi.html,https://www.prontocantiere.it/media/catalog/product/cache/1/small_image/300x300/9df78eab33525d08d6e5fb8d27136e95/m/i/microtitina.jpg,"819,00 €",Monospazzola MICROTITINA Raimondi,"Monospazzola multiuso professionale, facile da usare, eccezionale macchinario da cantiere con molteplici usi.


PER RICAMBI ED ACCESSORI CONTATTACI 0438418365 Cod. 206","Breve: Monospazzola multiuso professionale, facile da usare, eccezionale macchinario da cantiere con molteplici usi.


PER RICAMBI ED ACCESSORI CONTATTACI 0438418365 Cod. 206"
https://www.prontocantiere.it/marchi/raimondi.html?limit=all,https://www.prontocantiere.it/marchi/raimondi/monospazzola-supertitina-raimondi.html,https://www.prontocantiere.it/media/catalog/product/cache/1/small_image/300x300/9df78eab33525d08d6e5fb8d27136e95/s/u/supertitina.jpg,"1.333,00 €",Monospazzola SUPERTITINA Raimondi,"Monospazzola multiuso professionale, facile da usare, eccezionale macchinario da cantiere con molteplici usi.


PER RICAMBI ED ACCESSORI CONTATTACI 0438418365 Cod. 122","Breve: Monospazzola multiuso professionale, facile da usare, eccezionale macchinario da cantiere con molteplici usi.


PER RICAMBI ED ACCESSORI CONTATTACI 0438418365 Cod. 122"
https://www.prontocantiere.it/marchi/raimondi.html?limit=all,https://www.prontocantiere.it/marchi/raimondi/montascale-speed-raimondi.html,https://www.prontocantiere.it/media/catalog/product/cache/1/small_image/300x300/9df78eab33525d08d6e5fb8d27136e95/s/c/schermata_2014-10-30_a_08.53.29.png,"48,00 €",Montascale speed Raimondi,Coppia speed per la posa dei gradini. Cod. 171,Breve: Coppia speed per la posa dei gradini. Cod. 171
https://www.prontocantiere.it/marchi/raimondi.html?limit=all,https://www.prontocantiere.it/marchi/raimondi/motokompass-dispositivo-per-sagomatura-circolare.html,https://www.prontocantiere.it/media/catalog/product/cache/1/small_image/300x300/9df78eab33525d08d6e5fb8d27136e95/m/o/motokompass_-_dispositivo_per_sagomatura_circolare_raimondi.png,"589,00 €",MOTOKOMPASS - DISPOSITIVO PER SAGOMATURA CIRCOLARE,MOTOKOMPASS è un dispositivo progettato per la realizzazione di elementi d'arredo tondi o con angoli arrotondati. Cod. 433KOMOHR,Breve: MOTOKOMPASS è un dispositivo progettato per la realizzazione di elementi d'arredo tondi o con angoli arrotondati. Cod. 433KOMOHR
https://www.prontocantiere.it/marchi/raimondi.html?limit=all,https://www.prontocantiere.it/marchi/raimondi/new-raizor-raimondi-plus-433cp00apr-sistema-di-taglio-di-lastre-grande-formato.html,https://www.prontocantiere.it/media/catalog/product/cache/1/small_image/300x300/9df78eab33525d08d6e5fb8d27136e95/r/a/raizor_new.png,"709,00 €",New Raizor Raimondi Plus 433CP00APR - Sistema di taglio di lastre grande formato,Nuovo sistema di taglio per lastre di grande formato di lungezza massima 330 cm (445 cm con prolunga opzionale) Cod. 433CP00APR,Breve: Nuovo sistema di taglio per lastre di grande formato di lungezza massima 330 cm (445 cm con prolunga opzionale) Cod. 433CP00APR
https://www.prontocantiere.it/marchi/raimondi.html?limit=all,https://www.prontocantiere.it/marchi/raimondi/no-dust-carter-di-aspirazione-per-smerigliatrice-angolare-raimondi.html,https://www.prontocantiere.it/media/catalog/product/cache/1/small_image/300x300/9df78eab33525d08d6e5fb8d27136e95/e/w/ewewwewewewew.png,"42,00 €",NO-DUST - Carter di aspirazione per smerigliatrice angolare Raimondi,Carter di aspirazione universale per tutti i modelli di smeirgliatrice angolare per dischi diam. 115 mm e 125 mm Cod. 433PWW115-125,Breve: Carter di aspirazione universale per tutti i modelli di smeirgliatrice angolare per dischi diam. 115 mm e 125 mm Cod. 433PWW115-125
https://www.prontocantiere.it/marchi/raimondi.html?limit=all,https://www.prontocantiere.it/marchi/raimondi/nuovo-bm180-plus-banco-di-lavoro-modulare-larghezza-variabile-100-150-cm-394mamk3plus.html,https://www.prontocantiere.it/media/catalog/product/cache/1/small_image/300x300/9df78eab33525d08d6e5fb8d27136e95/b/m/bm180_plus__mainjpg.jpg,"939,00 €",NUOVO BM180 PLUS -Banco di lavoro modulare larghezza variabile (100-150 cm) - 394MAMK3PLUS,Banco di lavoro modulare larghezza variabile 100-150 cm con gambe pieghevoli BM180PLUS Cod. 394MAMK3PLUS,Breve: Banco di lavoro modulare larghezza variabile 100-150 cm con gambe pieghevoli BM180PLUS Cod. 394MAMK3PLUS
https://www.prontocantiere.it/marchi/raimondi.html?limit=all,https://www.prontocantiere.it/marchi/raimondi/only-one-dispositivo-di-ausilio-alla-posa-di-piastrelle-di-grande-formato.html,https://www.prontocantiere.it/media/catalog/product/cache/1/small_image/300x300/9df78eab33525d08d6e5fb8d27136e95/d/o/download_10.jpg,"469,00 €",Only-One DISPOSITIVO DI AUSILIO ALLA POSA DI PIASTRELLE DI GRANDE FORMATO,Dispositivo di ausilio alla posa di piastrelle di grande formato Cod. 432KR02A,Breve: Dispositivo di ausilio alla posa di piastrelle di grande formato Cod. 432KR02A
https://www.prontocantiere.it/marchi/raimondi.html?limit=all,https://www.prontocantiere.it/marchi/raimondi/p-rex-dispositivo-si-ausilio-alla-troncatura-per-tagliapiastrelle-manuali-a-barra-singola-monocanna.html,https://www.prontocantiere.it/media/catalog/product/cache/1/small_image/300x300/9df78eab33525d08d6e5fb8d27136e95/p/-/p-rex_main.jpg,"79,00 €",P-REX DISPOSITIVO SI AUSILIO ALLA TRONCATURA PER TAGLIAPIASTRELLE MANUALI A BARRA SINGOLA (MONOCANNA),P-REX è un dispositivo da applicare a tagliapiastrelle manuali per agevolare la troncatura delle piastrelle/lastre. Cod. 254RAIPRAS,Breve: P-REX è un dispositivo da applicare a tagliapiastrelle manuali per agevolare la troncatura delle piastrelle/lastre. Cod. 254RAIPRAS
https://www.prontocantiere.it/marchi/raimondi.html?limit=all,https://www.prontocantiere.it/marchi/raimondi/pietra-ravviva-disco-45-x-230-x-h-25-mm-per-segatrici-e-foratrici-raimondi.html,https://www.prontocantiere.it/media/catalog/product/cache/1/small_image/300x300/9df78eab33525d08d6e5fb8d27136e95/p/i/pietra-ravviva-disco-45x230xh-25-mm-1-34x9-116xh-1-raimondi_1_4_14108_19399.jpeg,"12,00 €",Pietra ravviva disco 45 x 230 x h 25 mm per segatrici e foratrici Raimondi,Pietra ravviva disco (diamante) dimensioni 45 x 230 x 25 mm per segatrici e foratrici Raimondi. Cod. 288YA46,Breve: Pietra ravviva disco (diamante) dimensioni 45 x 230 x 25 mm per segatrici e foratrici Raimondi. Cod. 288YA46
https://www.prontocantiere.it/marchi/raimondi.html?limit=all,https://www.prontocantiere.it/marchi/raimondi/pinza-troncatrice-alti-spessori-6-a-20-mm.html,https://www.prontocantiere.it/media/catalog/product/cache/1/small_image/300x300/9df78eab33525d08d6e5fb8d27136e95/p/i/pinza_tronc_1_.jpg,"95,00 €",Pinza troncatrice alti spessori 6 a 20 mm,Pinza troncatrice alti spessori 6 a 20 mm Cod. 169TM01AN,Breve: Pinza troncatrice alti spessori 6 a 20 mm Cod. 169TM01AN
https://www.prontocantiere.it/marchi/raimondi.html?limit=all,https://www.prontocantiere.it/marchi/raimondi/pinza-troncatrice-per-spessori-3-12-mm.html,https://www.prontocantiere.it/media/catalog/product/cache/1/small_image/300x300/9df78eab33525d08d6e5fb8d27136e95/p/r/progetto_senza_titolo_10_.png,"70,00 €",Pinza troncatrice per spessori 3-12 mm,Pinza Troncatrice per spessori 3-12 mm Cod. 169TB RAI,Breve: Pinza Troncatrice per spessori 3-12 mm Cod. 169TB RAI
https://www.prontocantiere.it/marchi/raimondi.html?limit=all,https://www.prontocantiere.it/marchi/raimondi/pinza-troncatrice-raimondi-heavy-duty-per-piastrelle-e-lastre-3-20-mm.html,https://www.prontocantiere.it/media/catalog/product/cache/1/small_image/300x300/9df78eab33525d08d6e5fb8d27136e95/1/6/169tx01ar.png,"78,00 €",Pinza troncatrice Raimondi Heavy-Duty per piastrelle e lastre 3-20 mm,Pinza HEAVY-DUTY per la troncatura piastrelle e lastre di spessore da 3 a 20 mm Cod. 169TX01AR,Breve: Pinza HEAVY-DUTY per la troncatura piastrelle e lastre di spessore da 3 a 20 mm Cod. 169TX01AR
https://www.prontocantiere.it/marchi/raimondi.html?limit=all,https://www.prontocantiere.it/marchi/raimondi/polystycut-taglierina-a-caldo-per-pannelli-in-polistirolo-espanso.html,https://www.prontocantiere.it/media/catalog/product/cache/1/small_image/300x300/9df78eab33525d08d6e5fb8d27136e95/p/o/polystycut_raimondi.jpg,"950,00 €",POLYSTYCUT - Taglierina a caldo per pannelli in polistirolo espanso,"Taglia fino a 25 cm di spessore e fino a 120 cm di lunghezza, taglio inclinato da 0° a 90°. Cod. 194TCEU","Breve: Taglia fino a 25 cm di spessore e fino a 120 cm di lunghezza, taglio inclinato da 0° a 90°. Cod. 194TCEU"
https://www.prontocantiere.it/marchi/raimondi.html?limit=all,https://www.prontocantiere.it/marchi/raimondi/pomello-raimondi-305pf06c.html,https://www.prontocantiere.it/media/catalog/product/cache/1/small_image/300x300/9df78eab33525d08d6e5fb8d27136e95/i/m/immagine_whatsapp_2024-10-24_ore_15.10.18_5e831fb7.jpg,"4,00 €",POMELLO RAIMONDI 305PF06C,POMELLO RAIMONDI 305PF06C Cod. 305PF06C,Breve: POMELLO RAIMONDI 305PF06C Cod. 305PF06C
https://www.prontocantiere.it/marchi/raimondi.html?limit=all,https://www.prontocantiere.it/marchi/raimondi/power-kit-raimondi-raizor.html,https://www.prontocantiere.it/media/catalog/product/cache/1/small_image/300x300/9df78eab33525d08d6e5fb8d27136e95/k/i/kit_power_raizor.png,"1.499,00 €",POWER KIT RAIMONDI HIKOKI MONTOLIT GRANDE FORMATO,RAIMONDI RAIZOR- SISTEMA PER IL TAGLIO DI LASTRE DI GRANDE FORMATO + POWER RAIZOR - GRUPPO DI TAGLIO AD ANGOLO VARIABILE + SMERIGLIATRICE HIKOKI G15VA 125 MM 1500 W + DISCO MONTOLIT CBX 125 MM Cod. POWERKIT1-GRANDEFORMATO,Breve: RAIMONDI RAIZOR- SISTEMA PER IL TAGLIO DI LASTRE DI GRANDE FORMATO + POWER RAIZOR - GRUPPO DI TAGLIO AD ANGOLO VARIABILE + SMERIGLIATRICE HIKOKI G15VA 125 MM 1500 W + DISCO MONTOLIT CBX 125 MM Cod. POWERKIT1-GRANDEFORMATO
https://www.prontocantiere.it/marchi/raimondi.html?limit=all,https://www.prontocantiere.it/marchi/raimondi/power-raizor-gruppo-di-taglio-ad-angolo-variabile.html,https://www.prontocantiere.it/media/catalog/product/cache/1/small_image/300x300/9df78eab33525d08d6e5fb8d27136e95/p/o/power-raizor-main.jpg,"469,00 €",POWER RAIZOR - GRUPPO DI TAGLIO AD ANGOLO VARIABILE,POWER RAIZOR - GRUPPO DI TAGLIO AD ANGOLO VARIABILE 45°/90°/180° + angoli intermedi 30°/47°/70° - Spessore taglio : 20 mm a 90° - 16 mm a 45° e 180° Cod. 433PWROH EUD,Breve: POWER RAIZOR - GRUPPO DI TAGLIO AD ANGOLO VARIABILE 45°/90°/180° + angoli intermedi 30°/47°/70° - Spessore taglio : 20 mm a 90° - 16 mm a 45° e 180° Cod. 433PWROH EUD
https://www.prontocantiere.it/marchi/raimondi.html?limit=all,https://www.prontocantiere.it/marchi/raimondi/power-vacuum-kit-raimondi.html,https://www.prontocantiere.it/media/catalog/product/cache/1/small_image/300x300/9df78eab33525d08d6e5fb8d27136e95/p/v/pvk_432hakitr_main_b_dsc_8860_ok_.jpg,"469,00 €",Power-Vacuum Kit Raimondi,Kit per la creazione automatica del vuoto dei dispositivi di trasporto equipaggiati con ventose vacuum Cod. 432HAKITR,Breve: Kit per la creazione automatica del vuoto dei dispositivi di trasporto equipaggiati con ventose vacuum Cod. 432HAKITR
https://www.prontocantiere.it/marchi/raimondi.html?limit=all,https://www.prontocantiere.it/marchi/raimondi/segatrice-zoe-130-raimondi.html,https://www.prontocantiere.it/media/catalog/product/cache/1/small_image/300x300/9df78eab33525d08d6e5fb8d27136e95/z/o/zoe-130.jpg,"3.120,00 €",PROMO Segatrice ZOE 130 Raimondi,Segatrice con motore scorrevole Cod. 420130A,Breve: Segatrice con motore scorrevole Cod. 420130A
https://www.prontocantiere.it/marchi/raimondi.html?limit=all,https://www.prontocantiere.it/marchi/raimondi/protezione-in-plastica-per-foratrice-raimondi-art-263lx04a1.html,https://www.prontocantiere.it/media/catalog/product/cache/1/small_image/300x300/9df78eab33525d08d6e5fb8d27136e95/p/r/protezione_trasparente.jpg,"12,00 €",Protezione in plastica per foratrice Raimondi art. 263LX04A1,Protezione in plastica per foratrice Raimondi art. 263LX04A1 Cod. 263LX04A1,Breve: Protezione in plastica per foratrice Raimondi art. 263LX04A1 Cod. 263LX04A1
https://www.prontocantiere.it/marchi/raimondi.html?limit=all,https://www.prontocantiere.it/marchi/raimondi/rai-cut-telaio-munito-di-mandrino-universale-per-smerigliatrice-angolare-per-sistema-rai-fix-299pfmk2eu.html,https://www.prontocantiere.it/media/catalog/product/cache/1/small_image/300x300/9df78eab33525d08d6e5fb8d27136e95/r/a/rai_cut.png,"179,00 €",RAI CUT - Telaio munito di mandrino universale per smerigliatrice angolare per sistema RAI-FIX- 299PFMK2EU,"Il gruppo scanalatore RAI-CUT è parte integrante del sistema RAI-FIX ed è indispensabile per effettuare con precisione l’incisione/scanalatura nel retro della piastrella/lastra (dove inserire il gancio RAI-FIX).

• RAI-CUT lavora su piastrelle di spessore massimo 30 mm (1 3/16”) e minimo 6 mm (1/4”).

• Realizzato in acciaio inox e munito di foro di aggancio (Ø 38 mm - 1 1/2”) per tubo aspiratore polveri.

• RAI-CUT è disponibile già equipaggiato con smerigliatrice angolare (900W) o senza.

• Grazie al sistema di aggancio semi-universale, RAI-CUT è compatibile con modelli delle migliori marche di smerigliatrici angolari.

• RAI-CUT taglia a secco con disco diamantato Ø 125 mm (5”). Cod. 299PFMK2EU","Breve: Il gruppo scanalatore RAI-CUT è parte integrante del sistema RAI-FIX ed è indispensabile per effettuare con precisione l’incisione/scanalatura nel retro della piastrella/lastra (dove inserire il gancio RAI-FIX).

• RAI-CUT lavora su piastrelle di spessore massimo 30 mm (1 3/16”) e minimo 6 mm (1/4”).

• Realizzato in acciaio inox e munito di foro di aggancio (Ø 38 mm - 1 1/2”) per tubo aspiratore polveri.

• RAI-CUT è disponibile già equipaggiato con smerigliatrice angolare (900W) o senza.

• Grazie al sistema di aggancio semi-universale, RAI-CUT è compatibile con modelli delle migliori marche di smerigliatrici angolari.

• RAI-CUT taglia a secco con disco diamantato Ø 125 mm (5”). Cod. 299PFMK2EU"
https://www.prontocantiere.it/marchi/raimondi.html?limit=all,https://www.prontocantiere.it/marchi/raimondi/raimondi-adattatore-per-utensili-attacco-vite-14-ma-per-ipertitina-e-microtitina.html,https://www.prontocantiere.it/media/catalog/product/cache/1/small_image/300x300/9df78eab33525d08d6e5fb8d27136e95/a/d/adattatore_2.png,"51,00 €",RAIMONDI Adattatore per utensili attacco vite 14 MA per Ipertitina e Microtitina,RAIMONDI Adattatore per utensili attacco vite 14 MA per Ipertitina e Microtitina Cod. COD.206FE01A,Breve: RAIMONDI Adattatore per utensili attacco vite 14 MA per Ipertitina e Microtitina Cod. COD.206FE01A
https://www.prontocantiere.it/marchi/raimondi.html?limit=all,https://www.prontocantiere.it/marchi/raimondi/raimondi-anello-per-aspirazione-per-ipertitina-e-microtitina-121ip01a.html,https://www.prontocantiere.it/media/catalog/product/cache/1/small_image/300x300/9df78eab33525d08d6e5fb8d27136e95/a/n/anello-per-aspirazione_2.png,"105,00 €",RAIMONDI Anello per aspirazione per Ipertitina e Microtitina 121IP01A,RAIMONDI Anello per aspirazione per Ipertitina e Microtitina Cod. 121I P01A,Breve: RAIMONDI Anello per aspirazione per Ipertitina e Microtitina Cod. 121I P01A
https://www.prontocantiere.it/marchi/raimondi.html?limit=all,https://www.prontocantiere.it/marchi/raimondi/raimondi-anello-tenuta-liquidi-in-lexan-per-ipertitina-e-microtitina-121ip03a.html,https://www.prontocantiere.it/media/catalog/product/cache/1/small_image/300x300/9df78eab33525d08d6e5fb8d27136e95/a/n/anello-tenuta-liquidi_2.png,"111,00 €",RAIMONDI Anello tenuta liquidi in lexan per Ipertitina e Microtitina 121IP03A,RAIMONDI Anello tenuta liquidi in lexan per Ipertitina e Microtitina Cod. 121IP03 A,Breve: RAIMONDI Anello tenuta liquidi in lexan per Ipertitina e Microtitina Cod. 121IP03 A
https://www.prontocantiere.it/marchi/raimondi.html?limit=all,https://www.prontocantiere.it/marchi/raimondi/raimondi-kit-zavorre-5-9-kg-per-ipertitina-e-microtitina-219zv01a.html,https://www.prontocantiere.it/media/catalog/product/cache/1/small_image/300x300/9df78eab33525d08d6e5fb8d27136e95/k/i/kit-zavorre_2.png,"105,00 €","RAIMONDI Kit zavorre 5,9 Kg per Ipertitina e Microtitina 219ZV01A","RAIMONDI Kit zavorre 5,9 Kg per Ipertitina e Microtitina Cod. COD.219ZV01A","Breve: RAIMONDI Kit zavorre 5,9 Kg per Ipertitina e Microtitina Cod. COD.219ZV01A"
https://www.prontocantiere.it/marchi/raimondi.html?limit=all,https://www.prontocantiere.it/marchi/raimondi/raimondi-kit-carrello-per-trasformare-ipertitina-in-ipertitina-plus.html,https://www.prontocantiere.it/media/catalog/product/cache/1/small_image/300x300/9df78eab33525d08d6e5fb8d27136e95/k/i/kit-carrello_1.png,"537,00 €",RAIMONDI Kit/Carrello per trasformare Ipertitina in Ipertitina plus,RAIMONDI Kit/Carrello per trasformare Ipertitina in Ipertitina plus Cod. COD.108KITBAS,Breve: RAIMONDI Kit/Carrello per trasformare Ipertitina in Ipertitina plus Cod. COD.108KITBAS
https://www.prontocantiere.it/marchi/raimondi.html?limit=all,https://www.prontocantiere.it/marchi/raimondi/raimondi-mola-diamantata-metallica-cod-274dc040-050.html,https://www.prontocantiere.it/media/catalog/product/cache/1/small_image/300x300/9df78eab33525d08d6e5fb8d27136e95/m/o/mola-diamantata1.png,"104,00 €",RAIMONDI Mola diamantata metallica COD.274DC040/050,RAIMONDI Mola diamantata metallica COD.274DC040/050 Cod. COD.274DC040/050,Breve: RAIMONDI Mola diamantata metallica COD.274DC040/050 Cod. COD.274DC040/050
https://www.prontocantiere.it/marchi/raimondi.html?limit=all,https://www.prontocantiere.it/marchi/raimondi/raimondi-mola-diamantata-metallica-cod-274dc100-120.html,https://www.prontocantiere.it/media/catalog/product/cache/1/small_image/300x300/9df78eab33525d08d6e5fb8d27136e95/m/o/mola-diamantata.png,"96,00 €",RAIMONDI Mola diamantata metallica COD.274DC100/120,RAIMONDI Mola diamantata metallica COD.274DC100/120 Cod. COD.274DC100/120,Breve: RAIMONDI Mola diamantata metallica COD.274DC100/120 Cod. COD.274DC100/120
https://www.prontocantiere.it/marchi/raimondi.html?limit=all,https://www.prontocantiere.it/marchi/raimondi/raimondi-mola-diamantata-metallica-cod-274dg040-050.html,https://www.prontocantiere.it/media/catalog/product/cache/1/small_image/300x300/9df78eab33525d08d6e5fb8d27136e95/m/o/mola-diamantata5_.png,"104,00 €",RAIMONDI Mola diamantata metallica COD.274DG040/050,RAIMONDI Mola diamantata metallica COD.274DG040/050 Cod. COD.274DG040/050,Breve: RAIMONDI Mola diamantata metallica COD.274DG040/050 Cod. COD.274DG040/050
https://www.prontocantiere.it/marchi/raimondi.html?limit=all,https://www.prontocantiere.it/marchi/raimondi/raimondi-mola-diamantata-metallica-cod-274dg100-120.html,https://www.prontocantiere.it/media/catalog/product/cache/1/small_image/300x300/9df78eab33525d08d6e5fb8d27136e95/m/o/mola-diamantata4.png,"98,00 €",RAIMONDI Mola diamantata metallica COD.274DG100/120,RAIMONDI Mola diamantata metallica COD.274DG100/120 Cod. COD.274DG100/120,Breve: RAIMONDI Mola diamantata metallica COD.274DG100/120 Cod. COD.274DG100/120
https://www.prontocantiere.it/marchi/raimondi.html?limit=all,https://www.prontocantiere.it/marchi/raimondi/raimondi-mola-diamantata-metallica-cod-274dm040-050.html,https://www.prontocantiere.it/media/catalog/product/cache/1/small_image/300x300/9df78eab33525d08d6e5fb8d27136e95/m/o/mola-diamantata3.png,"99,00 €",RAIMONDI Mola diamantata metallica COD.274DM040/050,RAIMONDI Mola diamantata metallica COD.274DM040/050 Cod. COD.274DM040/050,Breve: RAIMONDI Mola diamantata metallica COD.274DM040/050 Cod. COD.274DM040/050
https://www.prontocantiere.it/marchi/raimondi.html?limit=all,https://www.prontocantiere.it/marchi/raimondi/raimondi-mola-diamantata-metallica-cod-274dm100-120.html,https://www.prontocantiere.it/media/catalog/product/cache/1/small_image/300x300/9df78eab33525d08d6e5fb8d27136e95/m/o/mola-diamantata2.png,"96,00 €",RAIMONDI Mola diamantata metallica COD.274DM100/120,RAIMONDI Mola diamantata metallica COD.274DM100/120 Cod. COD.274DM100/120,Breve: RAIMONDI Mola diamantata metallica COD.274DM100/120 Cod. COD.274DM100/120
https://www.prontocantiere.it/marchi/raimondi.html?limit=all,https://www.prontocantiere.it/marchi/raimondi/raimondi-mola-in-ceramica-cr-cod-274dtcr0030.html,https://www.prontocantiere.it/media/catalog/product/cache/1/small_image/300x300/9df78eab33525d08d6e5fb8d27136e95/m/o/mola-ceramica3.png,"57,00 €",RAIMONDI Mola in ceramica CR COD.274DTCR0030,RAIMONDI Mola in ceramica CR COD.274DTCR0030 Cod. COD.274DTCR0030,Breve: RAIMONDI Mola in ceramica CR COD.274DTCR0030 Cod. COD.274DTCR0030
https://www.prontocantiere.it/marchi/raimondi.html?limit=all,https://www.prontocantiere.it/marchi/raimondi/raimondi-mola-in-ceramica-cr-cod-274dtcr0075.html,https://www.prontocantiere.it/media/catalog/product/cache/1/small_image/300x300/9df78eab33525d08d6e5fb8d27136e95/m/o/mola-ceramica2.png,"57,00 €",RAIMONDI Mola in ceramica CR COD.274DTCR0075,RAIMONDI Mola in ceramica CR COD.274DTCR0075 Cod. COD.274DTCR0075,Breve: RAIMONDI Mola in ceramica CR COD.274DTCR0075 Cod. COD.274DTCR0075
https://www.prontocantiere.it/marchi/raimondi.html?limit=all,https://www.prontocantiere.it/marchi/raimondi/raimondi-mola-in-ceramica-cr-cod-274dtcr0150.html,https://www.prontocantiere.it/media/catalog/product/cache/1/small_image/300x300/9df78eab33525d08d6e5fb8d27136e95/m/o/mola-ceramica.png,"57,00 €",RAIMONDI Mola in ceramica CR COD.274DTCR0150,RAIMONDI Mola in ceramica CR COD.274DTCR0150 Cod. COD.274DTCR0150,Breve: RAIMONDI Mola in ceramica CR COD.274DTCR0150 Cod. COD.274DTCR0150
https://www.prontocantiere.it/marchi/raimondi.html?limit=all,https://www.prontocantiere.it/marchi/raimondi/raimondi-mola-resinoide-epk-cod-274dtpk0050.html,https://www.prontocantiere.it/media/catalog/product/cache/1/small_image/300x300/9df78eab33525d08d6e5fb8d27136e95/m/o/mola-resinoide13.png,"57,00 €",RAIMONDI Mola resinoide EPK COD.274DTPK0050,RAIMONDI Mola resinoide EPK COD.274DTPK0050 Cod. COD.274DTPK0050,Breve: RAIMONDI Mola resinoide EPK COD.274DTPK0050 Cod. COD.274DTPK0050
