name,brand,description,price,image_url,product_page_url
Sikadur®-30,Sika,"Stucco epossidico adesivo, tixotropico, per placcaggi metallici e CFRP. Parte del sistema Sika® CarboDur®",N/A,N/A,https://ita.sika.com/it/edilizia/rinforzi-e-incollaggistrutturali/strutture-in-calcestruzzo/incollaggio-strutturaleeiniezioni/sikadur-30.html
Sikadur®-300,Sika,Resina epossidica bicomponente per impregnazione e laminazione di tessuti SikaWrap®,N/A,N/A,https://ita.sika.com/it/edilizia/rinforzi-e-incollaggistrutturali/strutture-in-calcestruzzo/tessuti-in-carbonio/sikadur-300.html
Sikadur®-31 CF Rapid,Sika,Adesivo epossidico bicomponente tixotropico,N/A,N/A,https://ita.sika.com/it/edilizia/rinforzi-e-incollaggistrutturali/strutture-in-calcestruzzo/incollaggio-strutturaleeiniezioni/sikadur-31-cf-rapid.html
Sikadur®-31+,Sika,Adesivo epossidico bicomponente a bassa emissione di VOC per incollaggio strutturale e ripristino del calcestruzzo,N/A,N/A,https://ita.sika.com/it/edilizia/rinforzi-e-incollaggistrutturali/strutture-in-calcestruzzo/incollaggio-strutturaleeiniezioni/sikadur-31-plus.html
Sikadur®-32 Fix,Sika,Resina epossidica fluida bicomponente per riprese di getto,N/A,N/A,https://ita.sika.com/it/edilizia/rinforzi-e-incollaggistrutturali/strutture-in-calcestruzzo/incollaggio-strutturaleeiniezioni/sikadur-32-fix.html
Sikadur®-32+,Sika,"Adesivo epossidico strutturale bicomponente per riprese di getto e ancoraggio, formulazione migliorata in termini di sostenibilità",N/A,N/A,https://ita.sika.com/it/edilizia/rinforzi-e-incollaggistrutturali/strutture-in-calcestruzzo/incollaggio-strutturaleeiniezioni/sikadur-32-plus.html
Sikadur®-330,Sika,Resina epossidica bicomponente da impregnazione dei sistemi realizzati in situ SikaWrap®,N/A,N/A,https://ita.sika.com/it/edilizia/rinforzi-e-incollaggistrutturali/strutture-in-calcestruzzo/tessuti-in-carbonio/sikadur-330.html
Sikadur®-42 SP,Sika,Malta epossidica tricomponente colabile,N/A,N/A,https://ita.sika.com/it/edilizia/rinnovo-e-protezionediedificiestrutture/ripristino-del-calcestruzzo/malte-per-inghisaggioemanutenzionestrade/sikadur-42-sp.html
Sikadur®-42+ HE Cold Climate,Sika,Malta epossidica colabile a tre componenti ad alte prestazioni per inghisaggio e getti di precisione sotto piastra,N/A,N/A,https://ita.sika.com/it/edilizia/rinnovo-e-protezionediedificiestrutture/ripristino-del-calcestruzzo/malte-per-inghisaggioemanutenzionestrade/sikadur-42-plus-hecoldclimate.html
Sikadur®-52 Injection Normal,Sika,Resina epossidica a bassa viscosità per iniezioni - pot life normale,N/A,N/A,https://ita.sika.com/it/edilizia/rinforzi-e-incollaggistrutturali/strutture-in-calcestruzzo/incollaggio-strutturaleeiniezioni/sikadur-52-injectionnormal.html
Sikadur®-53,Sika,Resina epossidica colabile idonea per iniezione e riempimenti sia in ambiente asciutto che in immersione,N/A,N/A,https://ita.sika.com/it/edilizia/rinforzi-e-incollaggistrutturali/strutture-in-calcestruzzo/incollaggio-strutturaleeiniezioni/sikadur-53.html
Sikaflex® PRO-3 Purform®,Sika,Sigillante poliuretanico per giunti a pavimento e applicazioni di ingegneria civile,N/A,N/A,https://ita.sika.com/it/edilizia/sigillatura-e-incollaggio/sigillatura-elastica/sikaflex-pro-3-purform.html
Sikaflex® PRO-3 SL,Sika,SIGILLANTE AUTOLIVELLANTE AD ELEVATE PRESTAZIONI PER GIUNTI A PAVIMENTO E PER APPLICAZIONI IN INGEGNERIA CIVILE,N/A,N/A,https://ita.sika.com/it/edilizia/sigillatura-e-incollaggio/sigillatura-elastica/sikaflex-pro-3-sl.html
Sikaflex® TS Plus,Sika,Sigillante elastico poliuretanico per cisterne e silo,N/A,N/A,https://ita.sika.com/it/edilizia/sigillatura-e-incollaggio/sigillatura-elastica/sikaflex-ts-plus.html
Sikaflex® Tank N,Sika,Sigillante elastico per giunti esposti ad agenti chimici,N/A,N/A,https://ita.sika.com/it/edilizia/sigillatura-e-incollaggio/sigillatura-elastica/sikaflex-tank-n.html
Sikaflex®-11 FC Purform®,Sika,Adesivo elastico multiuso e sigillante per giunti,N/A,N/A,https://ita.sika.com/it/edilizia/sigillatura-e-incollaggio/trattamento-dei-giunti/giunti-in-copertura/sikaflex-11-fc-purform.html
Sikaflex®-111 Stick & Seal,Sika,Sigillante e adesivo flessibile,N/A,N/A,https://ita.sika.com/it/edilizia/sigillatura-e-incollaggio/sigillatura-e-incollaggiouniversale/sikaflex-111-stickseal.html
Sikaflex®-112 Crystal Clear,Sika,Sigillante ed adesivo trasparente,N/A,N/A,https://ita.sika.com/it/edilizia/sigillatura-e-incollaggio/sigillatura-e-incollaggiouniversale/sikaflex-112-crystalclear.html
Sikaflex®-117 Metal Force,Sika,Adesivo elastico per l'incollaggio di elementi metallici,N/A,N/A,https://ita.sika.com/it/edilizia/sigillatura-e-incollaggio/trattamento-dei-giunti/giunti-in-copertura/sikaflex-117-metalforce.html
Sikaflex®-118 Extreme Grab,Sika,Adesivo per applicazioni edili,N/A,N/A,https://ita.sika.com/it/edilizia/sigillatura-e-incollaggio/sigillatura-e-incollaggiouniversale/sikaflex-118-extremegrab.html
Sikaflex®-406 KC,Sika,Sigillante poliuretanico monocomponente autolivellante ad alte prestazioni che può essere accelerato con SikaFlex® -406 KC Booster.,N/A,N/A,https://ita.sika.com/it/edilizia/sigillatura-e-incollaggio/trattamento-dei-giunti/giunti-a-pavimento/sikaflex-406-kc.html
Sikafloor® Comfort Adhesive,Sika,Adesivo poliuretanico bicomponente per la linea Sika ComfortFloor®,N/A,N/A,https://ita.sika.com/it/edilizia/pavimentazioni-epareti/edifici-pubblicieresidenziali/pavimenti-in-resina/prodotti/sikafloor-comfortadhesive.html
Sikafloor® Comfort Porefiller,Sika,Rasante turapori poliuretanico bicomponente per la linea Comfortfloor®,N/A,N/A,https://ita.sika.com/it/edilizia/pavimentazioni-epareti/edifici-pubblicieresidenziali/pavimenti-in-resina/prodotti/sikafloor-comfortporefiller.html
Sikafloor® Comfort Regupol-6015 H,Sika,Materassino antishock in gomma per la linea Sika ComfortFloor®,N/A,N/A,https://ita.sika.com/it/edilizia/pavimentazioni-epareti/edifici-pubblicieresidenziali/pavimenti-in-resina/prodotti/sikafloor-comfortregupol-6015h.html
Sikafloor® CureHard LI,Sika,Impregnante a base di silicato di litio lucido,N/A,N/A,https://ita.sika.com/it/edilizia/pavimentazioni-epareti/aree-di-stoccaggiologisticheecommerciali/antievaporanti-eantipolvere/sikafloor-curehardli.html
Sikafloor® DecoDur EM-21 Compact,Sika,"Rivestimento decorativo al quarzo elicotterato, colorato, ad elevata resistenza meccanica",N/A,N/A,https://ita.sika.com/it/edilizia/pavimentazioni-epareti/edifici-pubblicieresidenziali/pavimenti-in-resina/sistemi/sikafloor-decodurem-21compact.html
Sikafloor® HardTop CS-56 TrowelFinish,Sika,"Massetto cementizio di livellamento, ad alte resistenze ed a rapido indurimento",N/A,N/A,https://ita.sika.com/it/edilizia/pavimentazioni-epareti/aree-di-stoccaggiologisticheecommerciali/livellamento-dellesuperfici/sikafloor-hardtopcs-56trowelfinish.html
Sikafloor® HardTop CS-57 TrowelFinish,Sika,"MASSETTO CEMENTIZIO DI LIVELLAMENTO, AD ALTE RESISTENZE ED A RAPIDO INDURIMENTO",N/A,N/A,https://ita.sika.com/it/edilizia/pavimentazioni-epareti/aree-di-stoccaggiologisticheecommerciali/livellamento-dellesuperfici/sikafloor-hardtopcs-57trowelfinish.html
Sikafloor® MonoFlex MB-23,Sika,"Rivestimento poliuretanico monocomponente, liscio, con elevata capacità di fare ponte sulle fessure",N/A,N/A,https://ita.sika.com/it/edilizia/pavimentazioni-epareti/edifici-pubblicieresidenziali/balconi-terrazzescale/sistemi/sikafloor-monoflexmb-23.html
Sikafloor® MonoFlex MB-25,Sika,"Rivestimento poliuretanico monocomponente, finitura a spolvero, con elevata capacità di fare ponte sulle fessure",N/A,N/A,https://ita.sika.com/it/edilizia/pavimentazioni-epareti/edifici-pubblicieresidenziali/balconi-terrazzescale/sistemi/sikafloor-monoflexmb-25.html
Sikafloor® MultiDur EB-19,Sika,"Multistrato epossidico, antiscivolo, colorato e a rapido indurimento.",N/A,N/A,https://ita.sika.com/it/edilizia/pavimentazioni-epareti/industria-alimentareedellebevande/aree-umide/sistemi/sikafloor-multidureb-19.html
Sikafloor® MultiDur EB-27,Sika,Sistema di pavimentazione epossidica colorata antiscivolo,N/A,N/A,https://ita.sika.com/it/edilizia/pavimentazioni-epareti/aree-di-stoccaggiologisticheecommerciali/rivestimenti/sistemi/sikafloor-multidureb-27.html
Sikafloor® MultiDur EB-31,Sika,"Rivestimento epossidico colorato per pavimenti, antiscivolo, ad elevata resistenza chimica e meccanica",N/A,N/A,https://ita.sika.com/it/edilizia/pavimentazioni-epareti/aree-produttive-ediprocesso/aree-umide/sistemi/sikafloor-multidureb-31.html
Sikafloor® MultiDur EB-39,Sika,"Rivestimento epossidico multistrato, colorato, semi-elastico, con elevata resistenza chimica, per pavimenti.",N/A,N/A,https://ita.sika.com/it/edilizia/pavimentazioni-epareti/aree-produttive-ediprocesso/aree-umide/sistemi/sikafloor-multidureb-39.html
Sikafloor® MultiDur ES-24 ECF,Sika,"Rivestimento epossidico per pavimenti, liscio, colorato e conduttivo",N/A,N/A,https://ita.sika.com/it/edilizia/pavimentazioni-epareti/aree-con-requisitiesdeconduttivi/sistemi/sikafloor-multidures-24ecf.html
Sikafloor® MultiDur ES-26 N,Sika,Sistema di pavimentazione epossidica colorata liscia,N/A,N/A,https://ita.sika.com/it/edilizia/pavimentazioni-epareti/aree-produttive-ediprocesso/aree-asciutte/sistemi/sikafloor-multidures-26n.html
Sikafloor® MultiDur ES-31,Sika,"Rivestimento epossidico colorato per pavimenti, liscio, ad elevata resistenza chimica e meccanica.",N/A,N/A,https://ita.sika.com/it/edilizia/pavimentazioni-epareti/aree-produttive-ediprocesso/aree-asciutte/sistemi/sikafloor-multidures-31.html
Sikafloor® MultiDur ES-31 ECF,Sika,"Rivestimento epossidico per pavimenti, bicomponente, liscio, ad elevata resistenza chimica, elettro-conduttivo",N/A,N/A,https://ita.sika.com/it/edilizia/pavimentazioni-epareti/aree-con-requisitiesdeconduttivi/sistemi/sikafloor-multidures-31ecf.html
Sikafloor® MultiDur ES-39,Sika,"Rivestimento epossidico liscio, colorato, semi-elastico, con elevata resistenza chimica, per pavimenti.",N/A,N/A,https://ita.sika.com/it/edilizia/pavimentazioni-epareti/aree-produttive-ediprocesso/aree-asciutte/sistemi/sikafloor-multidures-39.html
Sikafloor® MultiDur ES-43 ESD,Sika,"Sistema epossidico per pavimenti, colorato, liscio, conduttivo con rivestimento poliuretanico ESD",N/A,N/A,https://ita.sika.com/it/edilizia/pavimentazioni-epareti/aree-con-requisitiesdeconduttivi/sistemi/sikafloor-multidures-43esd.html
Sikafloor® MultiDur ES-56 ESD,Sika,Sistema epossidico autolivellante antistatico per impiego in ambienti ESD,N/A,N/A,https://ita.sika.com/it/edilizia/pavimentazioni-epareti/aree-sterili/sistemi/sikafloor-multidures-56esd.html
Sikafloor® MultiDur ET-14 ECF,Sika,"RIVESTIMENTO EPOSSIDICO CONDUTTIVO, COLORATO, APPLICATO A RULLO CON FINITURA A BUCCIA D'ARANCIA",N/A,N/A,https://ita.sika.com/it/edilizia/pavimentazioni-epareti/aree-con-requisitiesdeconduttivi/sistemi/sikafloor-multiduret-14ecf.html
Sikafloor® MultiDur ET-19,Sika,RIVESTIMENTO EPOSSIDICO COLORATO CON FINITURA A BUCCIA D'ARANCIA,N/A,N/A,https://ita.sika.com/it/edilizia/pavimentazioni-epareti/aree-di-stoccaggiologisticheecommerciali/rivestimenti/sistemi/sikafloor-multiduret-19.html
Sikafloor® MultiDur ET-20,Sika,"Verniciatura epossidica, colorata e a rapido indurimento",N/A,N/A,https://ita.sika.com/it/edilizia/pavimentazioni-epareti/industria-alimentareedellebevande/aree-asciutte/sistemi/sikafloor-multiduret-20.html
Sikafloor® MultiDur ET-31 ECF/V,Sika,"RIVESTIMENTO EPOSSIDICO BICOMPONENTE, AD ELEVATA RESISTENZA CHIMICA, ELETTRO-CONDUTTIVO, per applicazione su superfici verticali",N/A,N/A,https://ita.sika.com/it/edilizia/pavimentazioni-epareti/aree-con-requisitiesdeconduttivi/sistemi/sikafloor-multiduret-31ecfv.html
Sikafloor® MultiDur WB-28,Sika,"Sistema di pavimentazione epossidico, antiscivolo, a base acqua, a basse emissioni di VOC",N/A,N/A,https://ita.sika.com/it/edilizia/pavimentazioni-epareti/aree-per-parcheggi/piani-controterra/sistemi/sikafloor-multidurwb-28.html
Sikafloor® MultiDur WS-18,Sika,"Sistema di rivestimento epossidico a finitura liscia, lucido, a base acqua, a basse emissioni di VOC",N/A,N/A,https://ita.sika.com/it/edilizia/pavimentazioni-epareti/edifici-pubblicieresidenziali/pavimenti-in-resina/sistemi/sikafloor-multidurws-18.html
Sikafloor® MultiFlex PB-55,Sika,Sistema parcheggio a base poliuretanica elastico per aree interne.,N/A,N/A,https://ita.sika.com/it/edilizia/pavimentazioni-epareti/aree-per-parcheggi/piani-intermedi/sistemi/sikafloor-multiflexpb-55.html
Sikafloor® MultiFlex PB-55 UV,Sika,"Rivestimento poliuretanico, elastico, UV resistente per aree parcheggio.",N/A,N/A,https://ita.sika.com/it/edilizia/pavimentazioni-epareti/aree-per-parcheggi/piani-superiori-eareeesterne/sistemi/sikafloor-multiflexpb-55uv.html
Sikafloor® MultiFlex PB-56 UV,Sika,"Sistema per pavimenti a base poliuretanica colorato, UV resistente, antiscivolo con proprietà di crack bridgnig per parcheggi",N/A,N/A,https://ita.sika.com/it/edilizia/pavimentazioni-epareti/aree-per-parcheggi/piani-superiori-eareeesterne/sistemi/sikafloor-multiflexpb-56uv.html
Sikafloor® MultiFlex PB-57,Sika,Sistema a base poliuretanica per aree parcheggio,N/A,N/A,https://ita.sika.com/it/edilizia/pavimentazioni-epareti/aree-per-parcheggi/piani-controterra/sistemi/sikafloor-multiflexpb-57.html
Sikafloor® ProSeal W,Sika,"Antievaporante per pavimenti in calcestruzzo, filmante, in dispersione acquosa",N/A,N/A,https://ita.sika.com/it/edilizia/pavimentazioni-epareti/aree-di-stoccaggiologisticheecommerciali/antievaporanti-eantipolvere/sikafloor-prosealw.html
Sikafloor® Pronto RB-24,Sika,"Sistema multistrato per pavimenti in zone umide, a rapido indurimento, ad elevata resistenza meccanica e chimica",N/A,N/A,https://ita.sika.com/it/edilizia/pavimentazioni-epareti/industria-alimentareedellebevande/aree-umide/sistemi/sikafloor-prontorb-24.html
Sikafloor® Pronto RB-25,Sika,"Sistema per pavimenti elastico, a rapido indurimento e impermeabile",N/A,N/A,https://ita.sika.com/it/edilizia/pavimentazioni-epareti/edifici-pubblicieresidenziali/balconi-terrazzescale/sistemi/sikafloor-prontorb-25.html
Sikafloor® Pronto RB-27,Sika,"Rivestimento multistrato, elastico e a rapido indurimento, per pavimenti aree refrigerate o celle frigorifere.",N/A,N/A,https://ita.sika.com/it/edilizia/pavimentazioni-epareti/aree-produttive-ediprocesso/minimi-tempi-di-fermo/sistemi/sikafloor-prontorb-27.html
Sikafloor® Pronto RB-35,Sika,"Sistema per pavimenti, a rapido indurimento, leggermente elastico",N/A,N/A,https://ita.sika.com/it/edilizia/pavimentazioni-epareti/aree-per-parcheggi/piani-intermedi/sistemi/sikafloor-prontorb-35.html
Sikafloor® Pronto RB-55,Sika,"SISTEMA PER PAVIMENTI A BASE DI RESINE ACRILICHE, A RAPIDO INDURIMENTO E CON PROPRIETA' DI CRACK-BRIDGING",N/A,N/A,https://ita.sika.com/it/edilizia/pavimentazioni-epareti/aree-produttive-ediprocesso/minimi-tempi-di-fermo/sistemi/sikafloor-prontorb-55.html
Sikafloor®-1 MetalTop,Sika,Spolvero metallico per strato d'usura di pavimentazioni,N/A,N/A,https://ita.sika.com/it/edilizia/pavimentazioni-epareti/aree-di-stoccaggiologisticheecommerciali/spolveri/sikafloor-1-metaltop.html
Sikafloor®-100 Level (IT),Sika,LIVELLINA CEMENTIZIA POLIMERO MODIFICATA PER PAVIMENTI RESIDENZIALI CON SPESSORI DA 2 A 10 mm,N/A,N/A,https://ita.sika.com/it/edilizia/pavimentazioni-epareti/edifici-pubblicieresidenziali/sottofondi-cementizi/sikafloor-100-levelit.html
Sikafloor®-11 Pronto,Sika,Primer bicomponente a base resine polimetilmetacrilate,N/A,N/A,https://ita.sika.com/it/edilizia/pavimentazioni-epareti/industria-alimentareedellebevande/aree-umide/prodotti/sikafloor-11-pronto.html
Sikafloor®-13 Pronto,Sika,Primer bicomponente a base resine polimetilmetacrilate,N/A,N/A,https://ita.sika.com/it/edilizia/pavimentazioni-epareti/industria-alimentareedellebevande/aree-umide/prodotti/sikafloor-13-pronto.html
Sikafloor®-14 Pronto,Sika,Legante bicomponente a base di resine polimetilmetacrilate per malte da livellamento e massetti autolivellanti.,N/A,N/A,https://ita.sika.com/it/edilizia/pavimentazioni-epareti/industria-alimentareedellebevande/aree-umide/prodotti/sikafloor-14-pronto.html
Sikafloor®-15 Pronto,Sika,Legante bicomponente elastomerico a base di resine polimetilmetacrilate per malte da livellamento e massetti autolivellanti.,N/A,N/A,https://ita.sika.com/it/edilizia/pavimentazioni-epareti/edifici-pubblicieresidenziali/balconi-terrazzescale/prodotti/sikafloor-15-pronto.html
Sikafloor®-150,Sika,"PRIMER BICOMPONENTE EPOSSIDICO, MALTA DA LIVELLAMENTO O MASSETTO EPOSSIDICO",N/A,N/A,https://ita.sika.com/it/edilizia/pavimentazioni-epareti/edifici-pubblicieresidenziali/pavimenti-in-resina/prodotti/sikafloor-150.html
Sikafloor®-151,Sika,"PRIMER EPOSSIDICO, MALTA DA LIVELLAMENTO E MASSETTO",N/A,N/A,https://ita.sika.com/it/edilizia/pavimentazioni-epareti/edifici-pubblicieresidenziali/balconi-terrazzescale/prodotti/sikafloor-151.html
Sikafloor®-154 W,Sika,Primer epossidico bicomponente a base acquosa per supporti cementizi,N/A,N/A,https://ita.sika.com/it/edilizia/pavimentazioni-epareti/pavimentazioni-sportive/rivestimenti-acrilici/sikafloor-154-w.html
Sikafloor®-155 WN,Sika,"Primer epossidico bicomponente, in emulsione acquosa",N/A,N/A,https://ita.sika.com/it/edilizia/pavimentazioni-epareti/aree-di-stoccaggiologisticheecommerciali/rivestimenti/prodotti/sikafloor-155-wn.html
Sikafloor®-169,Sika,Legante epossidico bicomponente a basse emissioni di VOC,N/A,N/A,https://ita.sika.com/it/edilizia/pavimentazioni-epareti/edifici-pubblicieresidenziali/pavimenti-in-resina/prodotti/sikafloor-169.html
Sikafloor®-17 Pronto,Sika,Rivestimento bicomponente a base di resine polimetilmetacrilate per aree umide o celle frigorifere.,N/A,N/A,https://ita.sika.com/it/edilizia/pavimentazioni-epareti/industria-alimentareedellebevande/aree-umide/prodotti/sikafloor-17-pronto.html
Sikafloor®-18 Pronto,Sika,Rivestimento bicomponente flessibile per aree interne ed esterne a base di resine polimetilmetacrilate,N/A,N/A,https://ita.sika.com/it/edilizia/pavimentazioni-epareti/edifici-pubblicieresidenziali/balconi-terrazzescale/prodotti/sikafloor-18-pronto.html
Sikafloor®-2 SynTop,Sika,Spolvero non metallico per strato d'usura di pavimentazioni,N/A,N/A,https://ita.sika.com/it/edilizia/pavimentazioni-epareti/aree-di-stoccaggiologisticheecommerciali/spolveri/sikafloor-2-syntop.html
Sikafloor®-200 Level (IT),Sika,LIVELLINA CEMENTIZIA POLIMERO MODIFICATA PER PAVIMENTI RESIDENZIALI DA 3–40 MM,N/A,N/A,https://ita.sika.com/it/edilizia/pavimentazioni-epareti/edifici-pubblicieresidenziali/sottofondi-cementizi/sikafloor-200-levelit.html
Sikafloor®-2020,Sika,Rivestimento monocomponente colorato in dispersione acquosa.,N/A,N/A,https://ita.sika.com/it/edilizia/pavimentazioni-epareti/pavimentazioni-sportive/rivestimenti-acrilici/sikafloor-2020.html
Sikafloor®-2030,Sika,"Strato di regolarizzazione acrilico a base acqua,monocomponente e colorato.",N/A,N/A,https://ita.sika.com/it/edilizia/pavimentazioni-epareti/pavimentazioni-sportive/rivestimenti-acrilici/sikafloor-2030.html
Sikafloor®-2040,Sika,Resina acrilica a base acqua per pavimentazioni,N/A,N/A,https://ita.sika.com/it/edilizia/pavimentazioni-epareti/pavimentazioni-sportive/rivestimenti-acrilici/sikafloor-2040.html
Sikafloor®-2100,Sika,Rivestimento per pavimenti pedonali a base di resina epossi-acrilica a base acqua,N/A,N/A,https://ita.sika.com/it/edilizia/pavimentazioni-epareti/pavimentazioni-sportive/rivestimenti-acrilici/sikafloor-2100.html
Sikafloor®-220 W Conductive,Sika,Primer epossidico bicomponente elettroconduttivo,N/A,N/A,https://ita.sika.com/it/edilizia/pavimentazioni-epareti/aree-con-requisitiesdeconduttivi/prodotti/sikafloor-220-wconductive.html
Sikafloor®-2350 ESD,Sika,Rivestimento epossidico elettrostatico per pavimenti conduttivi,N/A,N/A,https://ita.sika.com/it/edilizia/pavimentazioni-epareti/aree-sterili/prodotti/sikafloor-2350-esd.html
Sikafloor®-2510 W,Sika,Finitura epossidica all'acqua con basse emissioni di VOC,N/A,N/A,https://ita.sika.com/it/edilizia/pavimentazioni-epareti/edifici-pubblicieresidenziali/pavimenti-in-resina/prodotti/sikafloor-2510-w.html
Sikafloor®-262 AS N,Sika,Resina epossidica autolivellante per pavimenti a conducibilità elettrica,N/A,N/A,https://ita.sika.com/it/edilizia/pavimentazioni-epareti/aree-con-requisitiesdeconduttivi/prodotti/sikafloor-262-asn.html
Sikafloor®-262 AS N Thixo,Sika,"Resina epossidica per pavimenti a conducibilità elettrica, finitura a buccia d'arancia.",N/A,N/A,https://ita.sika.com/it/edilizia/pavimentazioni-epareti/aree-con-requisitiesdeconduttivi/prodotti/sikafloor-262-asnthixo.html
Sikafloor®-263 SL N,Sika,RESINA EPOSSIDICA BICOMPONENTE PER RIVESTIMENTI AUTOLIVELLANTI O MULTISTRATO,N/A,N/A,https://ita.sika.com/it/edilizia/pavimentazioni-epareti/aree-produttive-ediprocesso/aree-umide/prodotti/sikafloor-263-sln.html
Sikafloor®-264 N,Sika,RESINA EPOSSIDICA BICOMPONENTE COLORATA PER RIVESTIMENTI AUTOLIVELLANTI O STRATI DI FINITURA,N/A,N/A,https://ita.sika.com/it/edilizia/pavimentazioni-epareti/aree-produttive-ediprocesso/aree-umide/prodotti/sikafloor-264-n.html
Sikafloor®-264 N Thixo,Sika,RESINA EPOSSIDICA BICOMPONENTE PER VERNICIATURE A RULLO CON FINITURA A BUCCIA D'ARANCIA,N/A,N/A,https://ita.sika.com/it/edilizia/pavimentazioni-epareti/aree-produttive-ediprocesso/aree-asciutte/prodotti/sikafloor-264-nthixo.html
Sikafloor®-2640,Sika,"Epossidico bicomponente, colorato e a rapido indurimento.",N/A,N/A,https://ita.sika.com/it/edilizia/pavimentazioni-epareti/industria-alimentareedellebevande/aree-asciutte/prodotti/sikafloor-2640.html
Sikafloor®-3 QuartzTop (IT),Sika,Premiscelato di quarzi selezionati da applicare a spolvero per la realizzazione di strati di usura su pavimenti in calcestruzzo.,N/A,N/A,https://ita.sika.com/it/edilizia/pavimentazioni-epareti/aree-di-stoccaggiologisticheecommerciali/spolveri/sikafloor-3-quartztopit.html
Sikafloor®-300 Level,Sika,Livellina cementizia polimero modificata per spessori da 1 a 10 mm in classe C30-F7,N/A,N/A,https://ita.sika.com/it/edilizia/pavimentazioni-epareti/edifici-pubblicieresidenziali/sottofondi-cementizi/sikafloor-300-level.html
Sikafloor®-300 Rapid Level,Sika,"Livellina cementizia rapida, polimero modificata per spessori da 1 a 10 mm in classe C50-F10",N/A,N/A,https://ita.sika.com/it/edilizia/pavimentazioni-epareti/edifici-pubblicieresidenziali/sottofondi-cementizi/sikafloor-300-rapidlevel.html
Sikafloor®-3000,Sika,"Resina poliuretanica bicomponente, alifatica, autolivellante a basso contenuto di VOC, parte dei sistemi Sika Comfortfloor®",N/A,N/A,https://ita.sika.com/it/edilizia/pavimentazioni-epareti/edifici-pubblicieresidenziali/pavimenti-in-resina/prodotti/sikafloor-3000.html
Sikafloor®-304 W,Sika,"Rivestimento di finitura trasparente, opaco, bicomponente, a base di resina poliuretanica.",N/A,N/A,https://ita.sika.com/it/edilizia/pavimentazioni-epareti/edifici-pubblicieresidenziali/microcementi/sikafloor-304-w.html
Sikafloor®-305 W,Sika,"Rivestimento di finitura opaco, colorato, bicomponente, a base di resina poliuretanica, parte dei sistemi Sika ComfortFloor®",N/A,N/A,https://ita.sika.com/it/edilizia/pavimentazioni-epareti/industria-alimentareedellebevande/pareti-e-soffitti/prodotti/sikafloor-305-w.html
Sikafloor®-305 W ESD,Sika,"Rivestimento di finitura poliuretanico a base acqua, ESD, opaco, colorato e bicomponente",N/A,N/A,https://ita.sika.com/it/edilizia/pavimentazioni-epareti/aree-con-requisitiesdeconduttivi/prodotti/sikafloor-305-wesd.html
Sikafloor®-3240,Sika,"Autolivellante poliuretanico, bicomponente, semi-elastico e a bassa emissione di VOC",N/A,N/A,https://ita.sika.com/it/edilizia/pavimentazioni-epareti/aree-con-requisitiesdeconduttivi/prodotti/sikafloor-3240.html
Sikafloor®-330,Sika,"RESINA POLIURETANICA BICOMPONENTE, ELASTICA, AUTOLIVELLANTE E A BASSE EMISSIONI DI VOC.",N/A,N/A,https://ita.sika.com/it/edilizia/pavimentazioni-epareti/edifici-pubblicieresidenziali/pavimenti-in-resina/prodotti/sikafloor-330.html
Sikafloor®-3310,Sika,Autolivellante poliuretanico bicomponente e a bassa emissione di VOC.,N/A,N/A,https://ita.sika.com/it/edilizia/pavimentazioni-epareti/edifici-pubblicieresidenziali/pavimenti-in-resina/prodotti/sikafloor-3310.html
Sikafloor®-359 N,Sika,"Finitura poliuretanica semi-elastica, bicomponente, colorata",N/A,N/A,https://ita.sika.com/it/edilizia/pavimentazioni-epareti/aree-per-parcheggi/piani-superiori-eareeesterne/prodotti/sikafloor-359-n.html
Sikafloor®-376,Sika,Resina autolivellante poliuretanica con proprietà di crack-bridging,N/A,N/A,https://ita.sika.com/it/edilizia/pavimentazioni-epareti/aree-per-parcheggi/piani-intermedi/prodotti/sikafloor-376.html
Sikafloor®-377,Sika,Autolivellante poliuretanico con proprietà di crack-bridging,N/A,N/A,https://ita.sika.com/it/edilizia/pavimentazioni-epareti/aree-per-parcheggi/piani-intermedi/prodotti/sikafloor-377.html
Sikafloor®-378,Sika,"Finitura epossidica, colorata e semi-flessibile.",N/A,N/A,https://ita.sika.com/it/edilizia/pavimentazioni-epareti/aree-per-parcheggi/piani-intermedi/prodotti/sikafloor-378.html
Sikafloor®-381,Sika,Resina epossidica bicomponente per rivestimenti ad elevata resistenza chimica e meccanica,N/A,N/A,https://ita.sika.com/it/edilizia/pavimentazioni-epareti/aree-produttive-ediprocesso/aree-umide/prodotti/sikafloor-381.html
Sikafloor®-390 N,Sika,Rivestimento epossidico bicomponente flessibile chimico resistente.,N/A,N/A,https://ita.sika.com/it/edilizia/pavimentazioni-epareti/aree-produttive-ediprocesso/aree-umide/prodotti/sikafloor-390-n.html
Sikafloor®-400 N Elastic,Sika,Rivestimento poliuretanico monocomponente ad elevata elasticità,N/A,N/A,https://ita.sika.com/it/edilizia/pavimentazioni-epareti/edifici-pubblicieresidenziali/balconi-terrazzescale/prodotti/sikafloor-400-nelastic.html
