name,brand,description,price,image_url,product_page_url
Sikafloor®-420,Sika,Rivestimento poliuretanico monocomponente ad elevata elasticità,N/A,N/A,https://ita.sika.com/it/edilizia/pavimentazioni-epareti/edifici-pubblicieresidenziali/balconi-terrazzescale/prodotti/sikafloor-420.html
Sikafloor®-430 DecoCem,Sika,"Malta autolivellante cementizia fibrorinforzata a rapido indurimento per pavimentazioni ad alto effetto decorativo, ad uso interno",N/A,N/A,https://ita.sika.com/it/edilizia/pavimentazioni-epareti/edifici-pubblicieresidenziali/pavimenti-cementizidecorativi/sikafloor-430-decocem.html
Sikafloor®-701,Sika,"Primer epossidico bicomponente a basso contenuto di VOC, malta da livellamento o massetto epossidico",N/A,N/A,https://ita.sika.com/it/edilizia/pavimentazioni-epareti/aree-sterili/prodotti/sikafloor-701.html
Sikafloor®-81 EpoCem®,Sika,"Malta autolivellante epossicementizia, tricomponente",N/A,N/A,https://ita.sika.com/it/edilizia/pavimentazioni-epareti/aree-di-stoccaggiologisticheecommerciali/rivestimenti/prodotti/sikafloor-81-epocem.html
Sikagard® WallCoat AL-12 Hygienic,Sika,"Rivestimento acrilico monocomponente in emulsione acquosa, basse emissioni, elevata resistenza agli urti, per pareti verticali",N/A,N/A,https://ita.sika.com/it/edilizia/pavimentazioni-epareti/aree-sterili/sistemi/sikagard-wallcoatal-12hygienic.html
Sikagard® WallCoat AS-12 Hygienic,Sika,"Rivestimento acrilico monocomponente in emulsione acquosa, basse emissioni, per pareti verticali",N/A,N/A,https://ita.sika.com/it/edilizia/pavimentazioni-epareti/industria-alimentareedellebevande/pareti-e-soffitti/sistemi/sikagard-wallcoatas-12hygienic.html
Sikagard® WallCoat N,Sika,Vernice epossidica bicomponente in dispersione acquosa,N/A,N/A,https://ita.sika.com/it/edilizia/pavimentazioni-epareti/aree-sterili/prodotti/sikagard-wallcoatn.html
Sikagard® WallCoat PS-11,Sika,"Rivestimento per murature UV-resistente, base acqua e a bassa emissione",N/A,N/A,https://ita.sika.com/it/edilizia/pavimentazioni-epareti/industria-alimentareedellebevande/pareti-e-soffitti/sistemi/sikagard-wallcoatps-11.html
Sikagard® WallCoat PS-13,Sika,"Sistema di rivestimento a parete, a base acqua, a bassa emissione di VOC e UV resistente.",N/A,N/A,https://ita.sika.com/it/edilizia/pavimentazioni-epareti/industria-alimentareedellebevande/pareti-e-soffitti/sistemi/sikagard-wallcoatps-13.html
Sikagard® WallCoat WS-11,Sika,"Rivestimento liscio, in dispersione acquosa, facile da pulire, a basso contenuto di VOC / AMC",N/A,N/A,https://ita.sika.com/it/edilizia/pavimentazioni-epareti/industria-alimentareedellebevande/pareti-e-soffitti/sistemi/sikagard-wallcoatws-11.html
Sikagard®-207 W,Sika,N/A,N/A,N/A,https://ita.sika.com/it/edilizia/pavimentazioni-epareti/edifici-pubblicieresidenziali/pareti-e-soffitti/prodotti/sikagard-207-w.html
Sikagard®-403 W,Sika,"Rivestimento acrilico antibatterico, monocomponente a base acquosa per superfici orizzontali e verticali",N/A,N/A,https://ita.sika.com/it/edilizia/pavimentazioni-epareti/industria-alimentareedellebevande/pareti-e-soffitti/prodotti/sikagard-403-w.html
Sikagard®-405 W,Sika,"Rivestimento acrilico, monocomponente, a base acquosa",N/A,N/A,https://ita.sika.com/it/edilizia/pavimentazioni-epareti/industria-alimentareedellebevande/pareti-e-soffitti/prodotti/sikagard-405-w.html
Sikagard®-406 W,Sika,Rivestimento monocomponente acrilico in dispersione acquosa,N/A,N/A,https://ita.sika.com/it/edilizia/pavimentazioni-epareti/industria-alimentareedellebevande/pareti-e-soffitti/prodotti/sikagard-406-w.html
Sikagard®-550 W Elastic,Sika,"Rivestimento protettivo per calcestruzzo, con capacità di far ponte sulle fessure",N/A,N/A,https://ita.sika.com/it/edilizia/rinnovo-e-protezionediedificiestrutture/protezione-del-calcestruzzo/vernici-ed-impregnanti/sikagard-550-w-elastic.html
Sikagard®-551 S Elastic Primer,Sika,Primer per supporti in calcestruzzo molto compatti o porosi o per condizioni applicative difficoltose,N/A,N/A,https://ita.sika.com/it/edilizia/rinnovo-e-protezionediedificiestrutture/protezione-del-calcestruzzo/vernici-ed-impregnanti/sikagard-551-s-elasticprimer.html
Sikagard®-552 W Aquaprimer,Sika,Primer a base acquosa per rivestimenti,N/A,N/A,https://ita.sika.com/it/edilizia/rinnovo-e-protezionediedificiestrutture/protezione-del-calcestruzzo/vernici-ed-impregnanti/sikagard-552-w-aquaprimer.html
Sikagard®-63 N,Sika,"Rivestimento epossidico, bicomponente, chimico resistente",N/A,N/A,https://ita.sika.com/it/edilizia/rinnovo-e-protezionediedificiestrutture/protezione-del-calcestruzzo/vernici-ed-impregnanti/sikagard-63-n.html
Sikagard®-680 S Betoncolor,Sika,Vernice protettiva per calcestruzzo,N/A,N/A,https://ita.sika.com/it/edilizia/rinnovo-e-protezionediedificiestrutture/protezione-del-calcestruzzo/vernici-ed-impregnanti/sikagard-680-s-betoncolor.html
Sikagard®-700 S,Sika,Impregnazione idrofobica a base di silossani,N/A,N/A,https://ita.sika.com/it/edilizia/rinnovo-e-protezionediedificiestrutture/protezione-del-calcestruzzo/vernici-ed-impregnanti/sikagard-700-s.html
Sikagard®-740 W,Sika,Impregnazione reattiva idrorepellente a base silanica,N/A,N/A,https://ita.sika.com/it/edilizia/rinnovo-e-protezionediedificiestrutture/protezione-del-calcestruzzo/vernici-ed-impregnanti/sikagard-740-w.html
Sikagard®-750 Deco EpoCem®,Sika,Rivestimento decorativo in epossi-cemento,N/A,N/A,https://ita.sika.com/it/edilizia/pavimentazioni-epareti/edifici-pubblicieresidenziali/pavimenti-epossicementizidecorativi/sikagard-750-decoepocem.html
Sikagard®-790 All-in-One Protect,Sika,Protezione completa per superfici porose e pietre naturali,N/A,N/A,https://ita.sika.com/it/edilizia/rinnovo-e-protezionediedificiestrutture/protezione-del-calcestruzzo/vernici-ed-impregnanti/sikagard-790-all-in-oneprotect.html
Sikagard®-850 AG,Sika,Rivestimento protettivo permanente anti-graffiti e anti-poster,N/A,N/A,https://ita.sika.com/it/edilizia/rinnovo-e-protezionediedificiestrutture/protezione-del-calcestruzzo/vernici-ed-impregnanti/sikagard-850-ag.html
Sikalastic® Black,Sika,Membrana impermeabilizzante elastica a base bituminosa all’acqua,N/A,N/A,https://ita.sika.com/it/edilizia/impermeabilizzazionedistruttureeinfrastrutture/fondazioni/guaine-e-rivestimentibituminosi/sikalastic-black.html
Sikalastic® Flexistrip,Sika,Nastro butilico autoadesivo per membrane applicate liquide Sikalastic®,N/A,N/A,https://ita.sika.com/it/edilizia/sistemi-per-coperture/accessori-per-coperture/sikalastic-flexistrip.html
Sikalastic® Metal Primer,Sika,Primer epossidico bicomponente per supporti metallici non protetti e substrati bituminosi,N/A,N/A,https://ita.sika.com/it/edilizia/sistemi-per-coperture/accessori-per-coperture/sikalastic-metalprimer.html
Sikalastic® Primer PVC,Sika,Primer poliuretanico monocomponente,N/A,N/A,https://ita.sika.com/it/edilizia/sistemi-per-coperture/accessori-per-coperture/sikalastic-primerpvc.html
Sikalastic® Rapid Catalyst,Sika,Catalizzatore per resine PMMA Sikalastic® Rapid,N/A,N/A,https://ita.sika.com/it/edilizia/sistemi-per-coperture/cool-roof/membrane-liquideadaltariflettanza/sikalastic-rapidcatalyst.html
Sikalastic® Rapid Cleaner,Sika,Pretrattamento per superfici non assorbenti e per la pulizia di attrezzi,N/A,N/A,https://ita.sika.com/it/edilizia/sistemi-per-coperture/cool-roof/membrane-liquideadaltariflettanza/sikalastic-rapidcleaner.html
Sikalastic® Rapid Fleece P,Sika,"TESSUTO-NON-TESSUTO IN FIBRA SINTETICA PRE-FORATO, SPECIFICO PER L'ESECUZIONE DI DETTAGLI MEDIANTE RESINE IMPERMEABILIZZANTI SIKALASTIC® RAPID",N/A,N/A,https://ita.sika.com/it/edilizia/sistemi-per-coperture/cool-roof/membrane-liquideadaltariflettanza/sikalastic-rapidfleecep.html
Sikalastic® Rapid Fleece-110,Sika,Tessuto-non-tessuto in fibra sintetica specifico per resine impermeabilizzanti Sikalastic® Rapid,N/A,N/A,https://ita.sika.com/it/edilizia/sistemi-per-coperture/cool-roof/membrane-liquideadaltariflettanza/sikalastic-rapidfleece-110.html
Sikalastic® Rapid-721 Thixo,Sika,"Resina impermeabilizzante bicomponente a rapido indurimento, a base di PMMA altamente flessibile, specifica per l'esecuzione di dettagli",N/A,N/A,https://ita.sika.com/it/edilizia/sistemi-per-coperture/cool-roof/membrane-liquideadaltariflettanza/sikalastic-rapid-721thixo.html
Sikalastic®-152,Sika,Malta cementizia flessibile fibrorinforzata per l'impermeabilizzazione e la protezione del calcestruzzo,N/A,N/A,https://ita.sika.com/it/edilizia/rinnovo-e-protezionediedificiestrutture/protezione-del-calcestruzzo/rasanti-cementizi/sikalastic-152.html
Sikalastic®-156,Sika,Malta cementizia ad elevata capacità di crack-bridging per impermeabilizzazione e protezione di substrati cementizi,N/A,N/A,https://ita.sika.com/it/edilizia/rinnovo-e-protezionediedificiestrutture/protezione-del-calcestruzzo/rasanti-cementizi/sikalastic-156.html
Sikalastic®-1K,Sika,Malta cementizia monocomponente fibrorinforzata per impermeabilizzazioni flessibili e protezione del calcestruzzo,N/A,N/A,https://ita.sika.com/it/edilizia/rinnovo-e-protezionediedificiestrutture/protezione-del-calcestruzzo/rasanti-cementizi/sikalastic-1k.html
Sikalastic®-1K ES,Sika,"Malta monocomponente, fibrorinforzata e flessibile per l'impermeabilizzazione e la protezione del calcestruzzo.",N/A,N/A,https://ita.sika.com/it/edilizia/impermeabilizzazionedistruttureeinfrastrutture/fondazioni/malte-impermeabilizzanti/sikalastic-1k-es.html
Sikalastic®-250 TC,Sika,"Vernice protettiva bicomponente senza solvente, colorata o ad alta riflettanza solare, per rivestimenti in poliurea",N/A,N/A,https://ita.sika.com/it/edilizia/sistemi-per-coperture/coperture-a-vista/membrane-liquideapplicazionemanuale/sikalastic-250-tc.html
Sikalastic®-445,Sika,RIVESTIMENTO DI FINITURA POLIURETANICO ALIFATICO MONOCOMPONENTE PER MEMBRANE LIQUIDE IMPERMEABILIZZANTI PER COPERTURE,N/A,N/A,https://ita.sika.com/it/edilizia/sistemi-per-coperture/rifacimento-coperture/copertura-in-lamiera/membrane-liquide/sikalastic-445.html
Sikalastic®-510 Standard IT,Sika,MEMBRANA LIQUIDA IMPERMEABILIZZANTE E RIVESTIMENTO DECORATIVO ELASTOMERICO,N/A,N/A,https://ita.sika.com/it/edilizia/sistemi-per-coperture/rifacimento-coperture/copertura-in-lamiera/membrane-liquide/sikalastic-510-standardit.html
Sikalastic®-520 Fiber IT,Sika,MEMBRANA LIQUIDA FIBRORINFORZATA IMPERMEABILIZZANTE E RIVESTIMENTO DECORATIVO ELASTOMERICO,N/A,N/A,https://ita.sika.com/it/edilizia/sistemi-per-coperture/rifacimento-coperture/copertura-in-lamiera/membrane-liquide/sikalastic-520-fiberit.html
Sikalastic®-530 Reflex IT,Sika,"membrana liquida impermeabilizzante e rivestimento protettivo ad elevata riflettanza solare per coperture, resistente ai ristagni di acqua",N/A,N/A,https://ita.sika.com/it/edilizia/sistemi-per-coperture/rifacimento-coperture/copertura-in-lamiera/membrane-liquide/sikalastic-530-reflexit.html
Sikalastic®-6100 FX,Sika,"Membrana impermeabilizzante monocomponente elastica, classe A4 crack bridging, ad alta resa, per l'impermeabilizzazione e la protezione del calcestruzzo e per solette ricoperte con asfalto",N/A,N/A,https://ita.sika.com/it/edilizia/soluzioni-per-infrastrutture/impermeabilizzazione/sikalastic-6100fx.html
Sikalastic®-612,Sika,Membrana liquida impermeabilizzante poliuretanica monocomponente,N/A,N/A,https://ita.sika.com/it/edilizia/sistemi-per-coperture/rifacimento-coperture/copertura-in-lamiera/membrane-liquide/sikalastic-612.html
Sikalastic®-614,Sika,Membrana liquida impermeabilizzante poliuretanica monocomponente,N/A,N/A,https://ita.sika.com/it/edilizia/sistemi-per-coperture/rifacimento-coperture/coperture-in-mantosintetico/membrane-liquide/sikalastic-614.html
Sikalastic®-641,Sika,MEMBRANA LIQUIDA POLIURETANICA A RIDOTTO ODORE PER IMPERMEABILIZZAZIONE DI COPERTURE,N/A,N/A,https://ita.sika.com/it/edilizia/sistemi-per-coperture/rifacimento-coperture/coperture-in-mantosintetico/membrane-liquide/sikalastic-641.html
Sikalastic®-822,Sika,Membrana liquida impermeabilizzante per applicazioni manuali,N/A,N/A,https://ita.sika.com/it/edilizia/impermeabilizzazionedistruttureeinfrastrutture/impalcati-di-ponti/sikalastic-822.html
Sikalastic®-835 I,Sika,Membrana impermeabilizzante bicomponente a base poliurea pura ad elevate caratteristiche chimico/meccaniche,N/A,N/A,https://ita.sika.com/it/edilizia/impermeabilizzazionedistruttureeinfrastrutture/impianto-trattamentoacquereflue/guaine-liquide-reattive/sikalastic-835-i.html
Sikalastic®-836 DW,Sika,Membrana impermeabilizzante a base poliurea idonea per impianti di acqua potabile,N/A,N/A,https://ita.sika.com/it/edilizia/impermeabilizzazionedistruttureeinfrastrutture/serbatoi-per-acquepotabili/sikalastic-836-dw.html
Sikalastic®-838 LM,Sika,"MEMBRANA IMPERMEABILIZZANTE BICOMPONENTE AD ELEVATA ELASTICITA' E BASSO MODULO ELASTICO, A BASE DI POLIUREA PURA",N/A,N/A,https://ita.sika.com/it/edilizia/sistemi-per-coperture/rifacimento-coperture/copertura-in-lamiera/membrane-liquidehot-spray/sikalastic-838-lm.html
Sikalastic®-839 LM,Sika,"MEMBRANA IMPERMEABILIZZANTE BICOMPONENTE AD ELEVATA ELASTICITA' E BASSO MODULO ELASTICO, A BASE DI POLIUREA PURA",N/A,N/A,https://ita.sika.com/it/edilizia/sistemi-per-coperture/rifacimento-coperture/copertura-in-lamiera/membrane-liquidehot-spray/sikalastic-839-lm.html
Sikalastic®-8440,Sika,Membrana liquida chimico resistente a base di poliurea pura,N/A,N/A,https://ita.sika.com/it/edilizia/impermeabilizzazionedistruttureeinfrastrutture/impianto-trattamentoacquereflue/guaine-liquide-reattive/sikalastic-8440.html
Sikalastic®-851,Sika,Membrana liquida ibrida a base poliuretano/poliurea,N/A,N/A,https://ita.sika.com/it/edilizia/impermeabilizzazionedistruttureeinfrastrutture/impalcati-di-ponti/sikalastic-851.html
Sikalastic®-851 R,Sika,Membrana bicomponente applicata a spruzzo per impermeabilizzazione di coperture,N/A,N/A,https://ita.sika.com/it/edilizia/sistemi-per-coperture/rifacimento-coperture/copertura-in-lamiera/membrane-liquidehot-spray/sikalastic-851-r.html
Sikalastic®-8800,Sika,Membrana liquida in poliurea pura,N/A,N/A,https://ita.sika.com/it/edilizia/impermeabilizzazionedistruttureeinfrastrutture/fondazioni/guaine-liquide-reattive/sikalastic-8800.html
Sikament®-100,Sika,"Superfluidificante e riduttore d’acqua, per il confezionamento di calcestruzzi normali e di alta qualità",N/A,N/A,https://ita.sika.com/it/edilizia/tecnologia-del-cementoedelcalcestruzzo/calcestruzzo/calcestruzzo-preconfezionato/sikament-100.html
Sikament®-220,Sika,"Superfluidificante e riduttore d’acqua, accelerante di indurimento, per il confezionamento di calcestruzzi ad alta resistenza",N/A,N/A,https://ita.sika.com/it/edilizia/tecnologia-del-cementoedelcalcestruzzo/calcestruzzo/calcestruzzo-preconfezionato/sikament-220.html
Sikaplan® G-15,Sika,MANTO IMPERMEABILE SINTETICO PER IMPERMEABILIZZAZIONE DICOPERTURE A VISTA FISSATE MECCANICAMENTE,N/A,N/A,https://ita.sika.com/it/edilizia/sistemi-per-coperture/rifacimento-coperture/coperture-in-mantosintetico/manti-fissati-meccanicamente/sikaplan-g-15.html
Sikaplan® G-18,Sika,MANTO IMPERMEABILE SINTETICO PER IMPERMEABILIZZAZIONE DI COPERTUREA VISTA FISSATE MECCANICAMENTE,N/A,N/A,https://ita.sika.com/it/edilizia/sistemi-per-coperture/rifacimento-coperture/coperture-in-mantosintetico/manti-fissati-meccanicamente/sikaplan-g-18.html
Sikaplan® G-20,Sika,MANTO IMPERMEABILE SINTETICO PER IMPERMEABILIZZAZIONE DI COPERTUREA VISTA FISSATE MECCANICAMENTE,N/A,N/A,https://ita.sika.com/it/edilizia/sistemi-per-coperture/rifacimento-coperture/coperture-in-mantosintetico/manti-fissati-meccanicamente/sikaplan-g-20.html
Sikaplan® G-24,Sika,MANTO IMPERMEABILE SINTETICO PER IMPERMEABILIZZAZIONE DI COPERTUREA VISTA FISSATE MECCANICAMENTE,N/A,N/A,https://ita.sika.com/it/edilizia/sistemi-per-coperture/rifacimento-coperture/coperture-in-mantosintetico/manti-fissati-meccanicamente/sikaplan-g-24.html
Sikaplan® SGK-15,Sika,MANTO SINTETICO PER L'IMPERMEABILIZZAZIONE DI COPERTURE A VISTAMEDIANTE INCOLLAGGIO,N/A,N/A,https://ita.sika.com/it/edilizia/sistemi-per-coperture/rifacimento-coperture/coperture-in-guainabituminosa/manti-incollati/sikaplan-sgk-15.html
Sikaplan® SGK-18,Sika,MANTO SINTETICO PER L'IMPERMEABILIZZAZIONE DI COPERTURE A VISTAMEDIANTE INCOLLAGGIO,N/A,N/A,https://ita.sika.com/it/edilizia/sistemi-per-coperture/rifacimento-coperture/coperture-in-guainabituminosa/manti-incollati/sikaplan-sgk-18.html
Sikaplan® SGmA-15,Sika,MANTO SINTETICO PER IMPERMEABILIZZAZIONE DI COPERTURE ZAVORRATE,N/A,N/A,https://ita.sika.com/it/edilizia/sistemi-per-coperture/coperture-praticabili/manti-sintetici-incollati/sikaplan-sgma-15.html
Sikaplan® SGmA-18,Sika,MANTO SINTETICO PER IMPERMEABILIZZAZIONE DI COPERTURE ZAVORRATE,N/A,N/A,https://ita.sika.com/it/edilizia/sistemi-per-coperture/coperture-praticabili/manti-sintetici-incollati/sikaplan-sgma-18.html
Sikaplan® SGmA-20,Sika,MANTO SINTETICO PER IMPERMEABILIZZAZIONE DI COPERTURE ZAVORRATE,N/A,N/A,https://ita.sika.com/it/edilizia/sistemi-per-coperture/coperture-praticabili/manti-sintetici-incollati/sikaplan-sgma-20.html
Sikaplan® SGmA-24,Sika,MANTO SINTETICO PER IMPERMEABILIZZAZIONE DI COPERTURE ZAVORRATE,N/A,N/A,https://ita.sika.com/it/edilizia/sistemi-per-coperture/coperture-praticabili/manti-sintetici-incollati/sikaplan-sgma-24.html
Sikaplan® TB-15,Sika,MANTO SINTETICO PER L'IMPERMEABILIZZAZIONE DI COPERTURE ZAVORRATE,N/A,N/A,https://ita.sika.com/it/edilizia/sistemi-per-coperture/coperture-praticabili/manti-sintetici-incollati/sikaplan-tb-15.html
Sikaplan® TB-18,Sika,MANTO SINTETICO PER L'IMPERMEABILIZZAZIONE DI COPERTURE ZAVORRATE,N/A,N/A,https://ita.sika.com/it/edilizia/sistemi-per-coperture/coperture-praticabili/manti-sintetici-incollati/sikaplan-tb-18.html
Sikaplan® TM-15,Sika,MANTO SINTETICO PER L'IMPERMEABILIZZAZIONE DI COPERTURE A VISTAFISSATE MECCANICAMENTE,N/A,N/A,https://ita.sika.com/it/edilizia/sistemi-per-coperture/rifacimento-coperture/coperture-in-mantosintetico/manti-fissati-meccanicamente/sikaplan-tm-15.html
Sikaplan® TM-18,Sika,MANTO SINTETICO PER L'IMPERMEABILIZZAZIONE DI COPERTURE A VISTAFISSATE MECCANICAMENTE,N/A,N/A,https://ita.sika.com/it/edilizia/sistemi-per-coperture/rifacimento-coperture/coperture-in-mantosintetico/manti-fissati-meccanicamente/sikaplan-tm-18.html
Sikaplan® U-15,Sika,Manto sintetico per l'impermeabilizzazione di coperture zavorrate e a vista fissate meccanicamente,N/A,N/A,https://ita.sika.com/it/edilizia/sistemi-per-coperture/rifacimento-coperture/coperture-in-mantosintetico/manti-fissati-meccanicamente/sikaplan-u-15.html
Sikaplan® U-18,Sika,Manto sintetico per l'impermeabilizzazione di coperture zavorrate e a vista fissate meccanicamente,N/A,N/A,https://ita.sika.com/it/edilizia/sistemi-per-coperture/rifacimento-coperture/coperture-in-mantosintetico/manti-fissati-meccanicamente/sikaplan-u-18.html
Sikaplan® U-20,Sika,Manto sintetico per l'impermeabilizzazione di coperture zavorrate e a vista fissate meccanicamente,N/A,N/A,https://ita.sika.com/it/edilizia/sistemi-per-coperture/rifacimento-coperture/coperture-in-mantosintetico/manti-fissati-meccanicamente/sikaplan-u-20.html
Sikaplan® VG-15,Sika,MANTO IMPERMEABILE SINTETICO PER IMPERMEABILIZZAZIONE DICOPERTURE A VISTA FISSATE MECCANICAMENTE,N/A,N/A,https://ita.sika.com/it/edilizia/sistemi-per-coperture/rifacimento-coperture/coperture-in-mantosintetico/manti-fissati-meccanicamente/sikaplan-vg-15.html
Sikaplan® VG-18,Sika,MANTO IMPERMEABILE SINTETICO PER IMPERMEABILIZZAZIONE DICOPERTURE A VISTA FISSATE MECCANICAMENTE,N/A,N/A,https://ita.sika.com/it/edilizia/sistemi-per-coperture/rifacimento-coperture/coperture-in-mantosintetico/manti-fissati-meccanicamente/sikaplan-vg-18.html
Sikaplan® WP 1100-15 HL,Sika,N/A,N/A,N/A,https://ita.sika.com/it/edilizia/impermeabilizzazionedistruttureeinfrastrutture/fondazioni/manti-impermeabilisintetici/sikaplan-wp-1100-15hl.html
Sikaplan® WP 1100-20 HL,Sika,Manto impermeabile sintetico per strutture interrate e tunnel,N/A,N/A,https://ita.sika.com/it/edilizia/impermeabilizzazionedistruttureeinfrastrutture/gallerie/manti-impermeabili/sikaplan-wp-1100-20hl.html
Sikaplan® WP 1100-30 HL,Sika,N/A,N/A,N/A,https://ita.sika.com/it/edilizia/impermeabilizzazionedistruttureeinfrastrutture/gallerie/manti-impermeabili/sikaplan-wp-1100-30hl.html
Sikaplan® WP 5101-15 RE,Sika,N/A,N/A,N/A,https://ita.sika.com/it/edilizia/impermeabilizzazionedistruttureeinfrastrutture/stagni-e-laghetti/sikaplan-wp-5101-15re.html
Sikaplan® WP 5130-15 H,Sika,N/A,N/A,N/A,https://ita.sika.com/it/edilizia/impermeabilizzazionedistruttureeinfrastrutture/stagni-e-laghetti/sikaplan-wp-5130-15h.html
Sikaplan® WP 5130-15 R,Sika,N/A,N/A,N/A,https://ita.sika.com/it/edilizia/impermeabilizzazionedistruttureeinfrastrutture/stagni-e-laghetti/sikaplan-wp-5130-15r.html
Sikaplan® WP 5130-20 H,Sika,N/A,N/A,N/A,https://ita.sika.com/it/edilizia/impermeabilizzazionedistruttureeinfrastrutture/stagni-e-laghetti/sikaplan-wp-5130-20h.html
Sikaplan® WP 5140-15 H,Sika,N/A,N/A,N/A,https://ita.sika.com/it/edilizia/impermeabilizzazionedistruttureeinfrastrutture/stagni-e-laghetti/sikaplan-wp-5140-15h.html
Sikaplan® WP 5140-20 H,Sika,N/A,N/A,N/A,https://ita.sika.com/it/edilizia/impermeabilizzazionedistruttureeinfrastrutture/stagni-e-laghetti/sikaplan-wp-5140-20h.html
Sikaplan® WP 6110-15 H,Sika,N/A,N/A,N/A,https://ita.sika.com/it/edilizia/impermeabilizzazionedistruttureeinfrastrutture/impianto-trattamentoacquereflue/manti-impermeabilisintetici/sikaplan-wp-6110-15h.html
Sikaplan® WP 6110-20 H,Sika,N/A,N/A,N/A,https://ita.sika.com/it/edilizia/impermeabilizzazionedistruttureeinfrastrutture/impianto-trattamentoacquereflue/manti-impermeabilisintetici/sikaplan-wp-6110-20h.html
Sikaplan® WT 1200-16 C,Sika,N/A,N/A,N/A,https://ita.sika.com/it/edilizia/impermeabilizzazionedistruttureeinfrastrutture/fondazioni/manti-impermeabilisintetici/sikaplan-wt-1200-16c.html
Sikaplan® WT 1200-20 C,Sika,N/A,N/A,N/A,https://ita.sika.com/it/edilizia/impermeabilizzazionedistruttureeinfrastrutture/gallerie/manti-impermeabili/sikaplan-wt-1200-20c.html
Sikaplan® WT 1200-30 C,Sika,N/A,N/A,N/A,https://ita.sika.com/it/edilizia/impermeabilizzazionedistruttureeinfrastrutture/gallerie/manti-impermeabili/sikaplan-wt-1200-30c.html
Sikaplan® WT 4220-15 C,Sika,MANTO IMPERMEABILE SINTETICO IN FPO PER VASCHE DI CONTENIMENTO IDRICO,N/A,N/A,https://ita.sika.com/it/edilizia/impermeabilizzazionedistruttureeinfrastrutture/serbatoi-per-acquepotabili/sikaplan-wt-4220-15c.html
Sikaplan® WT 5210-20 CE,Sika,N/A,N/A,N/A,https://ita.sika.com/it/edilizia/impermeabilizzazionedistruttureeinfrastrutture/stagni-e-laghetti/sikaplan-wt-5210-20ce.html
Sikaplan® WT 5210-25 CE,Sika,N/A,N/A,N/A,https://ita.sika.com/it/edilizia/impermeabilizzazionedistruttureeinfrastrutture/stagni-e-laghetti/sikaplan-wt-5210-25ce.html
Sikaplan® WT 5300-13 C,Sika,N/A,N/A,N/A,https://ita.sika.com/it/edilizia/impermeabilizzazionedistruttureeinfrastrutture/stagni-e-laghetti/sikaplan-wt-5300-13c.html
Sikaplan® WT 5300-15 C,Sika,N/A,N/A,N/A,https://ita.sika.com/it/edilizia/impermeabilizzazionedistruttureeinfrastrutture/stagni-e-laghetti/sikaplan-wt-5300-15c.html
Sikaplan® WT 6200-20 C,Sika,N/A,N/A,N/A,https://ita.sika.com/it/edilizia/impermeabilizzazionedistruttureeinfrastrutture/impianto-trattamentoacquereflue/manti-impermeabilisintetici/sikaplan-wt-6200-20c.html
Sikasil® C,Sika,Sigillante siliconico per applicazioni in edilizia e ambienti sanitari.,N/A,N/A,https://ita.sika.com/it/edilizia/sigillatura-e-incollaggio/sigillatura-elastica/sikasil-c.html
Sikasil® Pool,Sika,Sigillante siliconico per piscine e aree permanentemente bagnate,N/A,N/A,https://ita.sika.com/it/edilizia/sigillatura-e-incollaggio/sigillatura-elastica/sikasil-pool.html
Sikasil® Universal,Sika,SIGILLANTE SILICONICO UNIVERSALE,N/A,N/A,https://ita.sika.com/it/edilizia/sigillatura-e-incollaggio/sigillatura-elastica/sikasil-universal.html
Sika® Antigelo OC,Sika,Additivo antigelo esente da cloruri,N/A,N/A,https://ita.sika.com/it/edilizia/tecnologia-del-cementoedelcalcestruzzo/calcestruzzo/tecnologia-per-pavimentazioniincalcestruzzo/sika-antigelo-oc.html
Sika® BBQ,Sika,ADESIVO PER L'ASSEMBLAGGIO DI BARBECUE PREFABBRICATI E MOBILI DA GIARDINO,N/A,N/A,https://ita.sika.com/it/edilizia/sigillatura-e-incollaggio/sigillatura-e-incollaggiouniversale/sika-bbq.html
Sika® Betonfloor Power-10,Sika,Additivo superfluidificante per calcestruzzi a presa controllata destinati a pavimentazioni industriali.,N/A,N/A,https://ita.sika.com/it/edilizia/tecnologia-del-cementoedelcalcestruzzo/calcestruzzo/tecnologia-per-pavimentazioniincalcestruzzo/sika-betonfloor-power-10.html
Sika® Betonfloor Power-30,Sika,N/A,N/A,N/A,https://ita.sika.com/it/edilizia/tecnologia-del-cementoedelcalcestruzzo/calcestruzzo/tecnologia-per-pavimentazioniincalcestruzzo/sika-betonfloor-power-30.html
Sika® CarboDur® BC 12,Sika,BARRE PULTRUSE IN FIBRA DI CARBONIO DA 12 MM PER IL RINFORZO STRUTTURALE (NSM),N/A,N/A,https://ita.sika.com/it/edilizia/rinforzi-e-incollaggistrutturali/strutture-in-calcestruzzo/lamine-in-carbonio/sika-carbodur-bc12.html
Sika® CarboDur® M,Sika,"Rinforzo strutturale preformato in classe C190/1800, costituito da lamine pultruse in fibra di carbonio, facente parte del sistema Sika® CarboDur®",N/A,N/A,https://ita.sika.com/it/edilizia/rinforzi-e-incollaggistrutturali/strutture-in-calcestruzzo/lamine-in-carbonio/sika-carbodur-m.html
Sika® CarboDur® S,Sika,"Rinforzo strutturale preformato in classe C150/2300, costituito da lamine pultruse in fibra di carbonio, facente parte del sistema Sika® CarboDur®",N/A,N/A,https://ita.sika.com/it/edilizia/rinforzi-e-incollaggistrutturali/strutture-in-calcestruzzo/lamine-in-carbonio/sika-carbodur-s.html
Sika® Concrete Primer,Sika,"Primer ibrido a base poliurea/poliuretano, bicomponente, a rapido indurimento, ad elevato residuo secco",N/A,N/A,https://ita.sika.com/it/edilizia/pavimentazioni-epareti/edifici-pubblicieresidenziali/balconi-terrazzescale/prodotti/sika-concrete-primer.html
